A73502,9,1,8,IMAGE,3,"Yf Christe be not rysen agayne , sayeth the Apostle , than are they vtterly peryshed that be entred theey slepe in Christ , than are we moost myserable of al me yf we haue our hope fixed in Christ , yf he were vnder the power of death not restored to blesse agayne.","if Christe be not rise again , say the apostle , than be they utter perish that be enter theey sleep in Christ , than be we most miserable of all i if we have our hope fix in Christ , if he be under the power of death not restore to bless again."
A73502,10,1,8,IMAGE,3,"But now is he rysen agayne fro death , sayth he , to be ye fyrst frutes of them that be aslepe , to rayse them to euerlastynge lyfe agayne.","but now be he rise again from death , say he , to be the first fruit of they that be asleep , to raise they to everlasting life again."
A73502,11,1,8,IMAGE,3,"Yea & yf it were not true , that Christe is ryse again : than were it neyther true , that he is ascended vp to heauen , nor yt he sent downe the holy goost , nor that he sytteth on the ryght hande of the father , hauynge the rule of heauen and earth , reygnynge as the prophete sayeth from see to see , <NOTE> nor that he shulde after thys worlde be a iudge of lyuynge & deade : to gyue rewarde to the good , and iugement to the euell.","yea and if it be not true , that Christe be rise again : than be it neither true , that he be ascend up to heaven , nor it he send down the holy ghost , nor that he sit on the right hand of the father , have the rule of heaven and earth , reign as the prophet say from see to see , <NOTE> nor that he shall after this world be a judge of live and dead : to give reward to the good , and judgement to the evil."
A73502,12,1,8,IMAGE,4,"That these lynkes therfore of oure fayth shulde all hange together in stedfaste confirmation : it pleased our sauiour not strayght way to wythdraw hymself from the corporall syght of hys disciples , but chose out fourty daies , wherin he wold declare vnto them by manyfolde and moost stronge argumentes and tokens that he had conquered death and was truly rysen agayne to lyfe. <NOTE> He began ( sayeth Luke ) at Moses and all the prophetes , and dyd expoune them the prophecies that were wrytten in al the scriptures of hym , to confirme the truth of his resurrection longe before spoken of , whych he verefyed in dede , as it is declared manyfestly by hys ofte appearaunce to sondry persons , at sondry tymes. <NOTE> Fyrst he sente hys angels to ye sepulchre , whych dyd shewe to certayne women , that the stone of the graue was remoued from the dore therof : and shewed them the empty graue sauynge that the buriall lynnen remayned therin , and of these sygnes were these women fully instructed yt he was rysen agayne and so dyd they testifye it opelye. <NOTE> After thys Iesus hymselfe appeared to Mary Magdalene , and after that to other certayne women , strayght afterwarde he appeared to Peter : than to the two disciples whych were goynge to Emaus. <NOTE> He appered to the disciples also as they were gathered together for feare of the Iues the dores shut. <NOTE> At an other tyme he was sene at the see of Tyberias of Peter and Thomas and other disciples whan they were fyshynge. <NOTE> He was sene of more tha fyue hundred brethren in the mount of galile , where Iesus appoynted them by hys angel whan he said : beholde he shal go before you into Galile , there shal ye se hym , as he hath said vnto you. <NOTE> After thys he appeared vnto Iames , and last of all he was vysiblye sene of al the Apostles , at such tyme , as he was take vp into heauen.","that these link therefore of our faith shall all hang together in steadfast confirmation : it please our saviour not straight way to wythdraw himself from the corporal sight of his disciple , but choose out forty day , wherein he will declare unto they by manifold and most strong argument and token that he have conquer death and be true rise again to life. <NOTE> he begin ( say Luke ) at Moses and all the prophet , and do expoune they the prophecy that be write in all the scripture of he , to confirm the truth of his resurrection long before speak of , which he verefy in deed , as it be declare manifest by his oft appearance to sundry person , at sundry time. <NOTE> first he send his angel to you sepulchre , which do show to certain woman , that the stone of the grave be remove from the door thereof : and show they the empty grave save that the burial linen remain therein , and of these sign be these woman full instruct it he be rise again and so do they testify it open. <NOTE> after this Jesus himself appear to marry Magdalene , and after that to other certain woman , straight afterward he appear to Peter : than to the two disciple which be go to Emaus. <NOTE> he appear to the disciple also as they be gather together for fear of the iue the door shut. <NOTE> at a other time he be see at the see of Tyberias of Peter and Thomas and other disciple when they be fish. <NOTE> he be see of more than five hundred brethren in the mount of galilee , where Jesus appoint they by his angel when he say : behold he shall go before you into galilee , there shall you see he , as he have say unto you. <NOTE> after this he appear unto Iames , and last of all he be vysiblye see of all the apostle , at such time , as he be take up into heaven."
A73502,13,1,8,IMAGE,4,"Thus at sondrye tymes he shewed hymselfe after he was rysen agayne , to cofirme this artycle , and in these reuelations somtyme he shewed them hys handes , hys feete , and hys syde , and bad them touch hym , that they shulde not take hym for a goost or a spirite.","thus at sundry time he show himself after he be rise again , to cofirme this article , and in these revelation sometime he show they his hand , his foot , and his side , and bid they touch he , that they shall not take he for a ghost or a spirit."
A73502,14,1,8,IMAGE,4,"Somtyme he also dyd eate wyth them , but euer he was talkynge wyth them of the kyngdome of God , to confirme the truth of hys resurrection.","sometime he also do eat with they , but ever he be talk with they of the kingdom of God , to confirm the truth of his resurrection."
A73502,15,1,9,IMAGE,4,"For then he opened theyr vnderstandyng to perceyue the scriptures , & sayd vnto them : Thus it is wrytten , and thus it behoued Christ to suffer , & to ryse from death the thyrde daye , <NOTE> and to haue preached openly in hys name penaunce and remission of synnes to all the nations of the worlde.","for than he open their understanding to perceive the scripture , and say unto they : thus it be write , and thus it behoove Christ to suffer , and to rise from death the three day , <NOTE> and to have preach open in his name penance and remission of sin to all the nation of the world."
A73502,16,1,9,IMAGE,4,"Ye see , good christen people , howe necessarie thys artycle of oure fayth is : seynge it was proued of Christ hymselfe by such euident reasons and tokens by so longe tyme & space.","you see , good christian people , how necessary this article of our faith be : sing it be prove of Christ himself by such evident reason and token by so long time and space."
A73502,17,1,9,IMAGE,4,"Now therfore as our sauiour was diliget for oure coforte and instruction to testifie it , so let vs be as ready in oure beleue to receyue it to our comforte and instruction.","now therefore as our saviour be diliget for our coforte and instruction to testify it , so let we be as ready in our believe to receive it to our comfort and instruction."
A73502,18,1,9,IMAGE,4,"As he dyed not for himselfe , no more dyd he ryse agayne for hymselfe.","as he die not for himself , no more do he rise again for himself."
A73502,19,1,9,IMAGE,4,"He was dead , sayth saint Paule , for our synnes and rose agayne for our iustification.","he be dead , say saint Paul , for our sin and rise again for our justification."
A73502,20,1,9,IMAGE,4,O moost comfortable worde euermore to be borne in remembraunce.,o most comfortable word evermore to be bear in remembrance.
A73502,21,1,9,IMAGE,4,"He dyed , sayeth he , to put away synne , he rose agayne to endewe vs wyth ryghtuousnes.","he die , say he , to put away sin , he rise again to endewe we with righteousness."
A73502,22,1,9,IMAGE,4,"Hys death toke awaye synne & malediction , hys death was the raunsome of them both Hys death destroyed death and ouercame the deuyll whych had the power of death in his subiectio.","his death take away sin and malediction , his death be the ransom of they both his death destroy death and overcome the devil which have the power of death in his subiectio."
A73502,23,1,9,IMAGE,4,Hys death destroyed hell wyth all the damnation therof.,his death destroy hell with all the damnation thereof.
A73502,24,1,9,IMAGE,4,Thus is death swalowed vp by Christes victorye : thus is hel spoyled for euer.,thus be death swallow up by Christ victory : thus be hell spoil for ever.
A73502,25,1,9,IMAGE,4,Yf any ma doubt of thys victorye : <NOTE> let Christes glorious resurrection declare hym the thynge.,if any man doubt of this victory : <NOTE> let Christ glorious resurrection declare he the thing.
A73502,26,1,9,IMAGE,4,Yf death coulde not kepe Christ vnder his dominion but that he arose again : it is manyfest that hys power was ouercome.,if death can not keep Christ under his dominion but that he arise again : it be manifest that his power be overcome.
A73502,27,1,9,IMAGE,4,"Yf death be coquered : than must it folowe , yt sinne , wherfore death was appoynted as the wages : must be also destroyed.","if death be coquer : than must it follow , it sin , wherefore death be appoint as the wage : must be also destroy."
A73502,28,1,9,IMAGE,4,"Yf death and synne be vanished away , then is the deuels tyrannye resysted whyche had the power of death and was the author of sinne and the ruler of hell.","if death and sin be vanish away , then be the devils tyranny resist which have the power of death and be the author of sin and the ruler of hell."
A73502,29,1,9,IMAGE,4,"Yf Christe had the victory of them all by the power of hys death , and openly proued it by hys valiaut resurrection , as it was not possible for hys great myght to be subdued of them , & than thys true that Christe dyed for oure synnes and rose agayne for our iustification : why may not we that be hys members by true fayth reioyce and boldly saye wyth the prophete Osee & the Apostle Paule , <NOTE> where is thy darte O death ? where is thy victory O hell ?","if Christe have the victory of they all by the power of his death , and open prove it by his valiaut resurrection , as it be not possible for his great may to be subdue of they , and than this true that Christe die for our sin and rise again for our justification : why may not our that be his member by true faith rejoice and bold say with the prophet Osee and the apostle Paul , <NOTE> where be thy dart oh death ? where be thy victory oh hell ?"
A73502,30,1,9,IMAGE,4,"Thankes be vnto God , saye they , whyche hath gyuen vs the victory by our Lord Christ Iesus.","thank be unto God , say they , which have give we the victory by our lord Christ Jesus."
A73502,31,1,9,IMAGE,4,"Thys myghtye conquest of hys resurrection was not only sygnifyed afore by dyuerse fygures of the olde testament , as by Sampson , whan he slewe the Lyon , <NOTE> out of whose mouth , came out swetnes and hony , and as Dauid bare his fygure , whan he delyuered ye lambe out of the Lyons mouth , and whan he ouercame , <NOTE> & slewe the great gyant Goliath , and as whan Ionas was swalowed vp of the whales mouth and cast vp agayne on londe to lyue : but was also moost clerely prophecied by the prophetes of the olde testament , & in the newe also confirmed by the Apostles.","this mighty conquest of his resurrection be not only sygnify afore by diverse figure of the old testament , as by Samson , when he slay the lion , <NOTE> out of who mouth , come out sweetness and honey , and as David bear his figure , when he deliver you lamb out of the lion mouth , and when he overcome , <NOTE> and slay the great giant Goliath , and as when Jonas be swallow up of the whale mouth and cast up again on land to live : but be also most clear prophesy by the prophet of the old testament , and in the new also confirm by the apostle."
A73502,32,1,9,IMAGE,4,He hath spoyled ( sayeth saynt Paule ) rule and power and all the dominion of our spirituall enemyes. <NOTE> He hath made a shewe of them openlye and hath triumphed ouer them in hys owne person.,he have spoil ( say saint Paul ) rule and power and all the dominion of our spiritual enemy. <NOTE> he have make a show of they open and have triumph over they in his own person.
A73502,33,1,9,IMAGE,4,"Thys is the myghty power of the Lorde , whome we beleue on.","this be the mighty power of the lord , who we believe on."
A73502,34,1,9,IMAGE,4,"By hys death hath he wrought thys victorye for vs , and by hys resurrection hathe he purchased euerlastynge lyfe & ryghtuousnes for vs. It had not ben ynough to be delyuered by hys death from synne : excepte by hys resurrection , we had ben endowed wyth ryghtuousnes.","by his death have he wrought this victory for we , and by his resurrection have he purchase everlasting life and righteousness for we it have not be enough to be deliver by his death from sin : except by his resurrection , we have be endow with righteousness."
A73502,35,1,10,IMAGE,4,"And it shulde not auayle vs to be delyuered from death , except he had rysen agayne , to open for vs the gates of heuen to enter into lyfe euerlastinge And therfore saynte Peter thanketh God the father of our Lorde Iesus Christ for hys abundaunt mercy , <NOTE> bycause he hath begotte vs ( sayeth he ) vnto a lyuely hope by the resurrection of Iesus Christe from death , to enioye an inheritaunce immortal that shal neuer perysh , whych is reserued in heauen for them that be kepte by the power of God thorowe fayth.","and it shall not avail we to be deliver from death , except he have rise again , to open for we the gate of heaven to enter into life everlasting and therefore faint Peter thank God the father of our lord Jesus Christ for his abundant mercy , <NOTE> because he have beget we ( say he ) unto a lively hope by the resurrection of Jesus Christe from death , to enjoy a inheritance immortal that shall never perish , which be reserve in heaven for they that be keep by the power of God through faith."
A73502,36,1,10,IMAGE,4,Thus hath hys resurrection wrought for vs lyfe & ryghtuousnes.,thus have his resurrection wrought for we life and righteousness.
A73502,37,1,10,IMAGE,4,"He passed thorowe death and hell to put vs in good hope , that by hys strength we shall do the same.","he pass through death and hell to put we in good hope , that by his strength we shall do the same."
A73502,38,1,10,IMAGE,4,"He payde the raunsome of synne , that it shulde not be layde to our charge.","he pay the ransom of sin , that it shall not be lay to our charge."
A73502,39,1,10,IMAGE,4,"He destroyed the deuell and all hys tyranny and openlye triumphed ouer hym , and toke awaye from hym all hys captiues , & hath raysed & set them wych hymselfe amonges the heauenly cytesins aboue. <NOTE> He dyed to destroy the rule of the deuell in vs and rose agayne to sende downe his holy spirite to rule in our hartis , to endow vs wyth perfyte ryghtuousnes.","he destroy the devil and all his tyranny and open triumph over he , and take away from he all his captive , and have raise and set they which himself among the heavenly cytesin above. <NOTE> he die to destroy the rule of the devil in we and rise again to send down his holy spirit to rule in our heart , to endow we with perfect righteousness."
A73502,40,1,10,IMAGE,4,Thus is it true that Dauid songe.,thus be it true that David song.
A73502,41,1,10,IMAGE,4,"Veritas de terra orta est , & iustitia de coelo prospexit. <NOTE> The truth of goddes promyse is in erth to man declared , or from the earth is the euerlastynge veritie goddes sonne rysen to lyfe : <NOTE> & the true ryghtuousnes of the holy goost lokynge out of heauen & is in moost lyberall larges dealt vpon all the worlde.","veritas de terra orta est , and iustitia de coelo prospexit. <NOTE> the truth of god promise be in earth to man declare , or from the earth be the everlasting verity god son rise to life : <NOTE> and the true righteousness of the holy ghost look out of heaven and be in most liberal largesse deal upon all the world."
A73502,42,1,10,IMAGE,4,"Thus is glorye and prayse reboundinge vpwarde to god aboue for hys mercy and truth : & thus is peace come downe fro heue to me of good & faithfull hartes. <NOTE> Thus is mercye and veritie as Dauid wryteth , met together , <NOTE> thus is peace and ryghtuousnes , embrasynge and kyssynge themselfe together.","thus be glory and praise rebound upward to god above for his mercy and truth : and thus be peace come down from heaven to i of good and faithful heart. <NOTE> thus be mercy and verity as David write , meet together , <NOTE> thus be peace and righteousness , embrace and kiss themselves together."
A73502,43,1,10,IMAGE,4,"Yf thou doutest of so great felicitie that is wrought for the O man , cal to thy mynde , that therfore haste thou receyued into thyne owne possession , the euerlastynge veritie our Sauiour Iesus Christe in forme of breade to confirme to thy conscience the truthe of all thys matter.","if thou doubt off so great felicity that be wrought for the oh man , call to thy mind , that therefore haste thou receive into thy own possession , the everlasting verity our saviour Jesus Christe in form of bread to confirm to thy conscience the truth of all this matter."
A73502,44,1,10,IMAGE,4,"Thou hast receyued hym : yf in true fayth and repentaunce of harte thou haste receyued hym , yf in purpose of amendement thou haste receyued hym for an euerlastinge gage and pledge of thy saluation.","thou have receive he : if in true faith and repentance of heart thou haste receive he , if in purpose of amendment thou haste receive he for a everlasting gage and pledge of thy salvation."
A73502,45,1,10,IMAGE,4,"Thou hast receyued hys body : which was ones broken and hys bloud shed for the remission of thy synne , thou hast receyued hys body , to haue with in the the father , the sonne , & the holy goost to dwell wyth the , to endowe the wyth grace , to strength the agaynst thy enemyes , and to comforte the with theyr presence.","thou have receive his body : which be one break and his blood shed for the remission of thy sin , thou have receive his body , to have with in the the father , the son , and the holy ghost to dwell with they , to endow they with grace , to strength they against thy enemy , and to comfort they with their presence."
A73502,46,1,10,IMAGE,4,"Thou hast receyued hys bodye to endowe the wyth euerlastyng ryghtuousnes , to assure the of euerlastynge blysse and lyfe of thy soule.","thou have receive his body to endow they with everlasting righteousness , to assure they of everlasting bliss and life of thy soul."
A73502,47,1,10,IMAGE,4,"For wyth Christe by true fayth arte thou quyckened agayne ( sayeth saynt Paule ) from death of synne to lyfe of grace , <NOTE> and in hope translated fro corporall and euer lastynge death , to the euerlastynge lyfe of glorye in heauen : where nowe thy conuersation shulde be and thy harte and desyre set.","for with Christe by true faith be thou quicken again ( say saint Paul ) from death of sin to life of grace , <NOTE> and in hope translate from corporal and ever last death , to the everlasting life of glory in heaven : where now thy conversation shall be and thy heart and desire set."
A73502,48,1,10,IMAGE,4,"Doubte not of the truth of thys matter , how great & excellent so euer these thynges be.","doubt not of the truth of this matter , how great and excellent so ever these thing be."
A73502,49,1,10,IMAGE,4,"It becommeth god to do no lytle dedes : how impossible so euer they seme to the : praye to god that thou mayest haue fayth to perceyue thys greate power of Christes resurrection , yt by fayth thou mayest certaynly beleue nothing to be impossible with god.","it become god to do no little deed : how impossible so ever they seem to they : pray to god that thou may have faith to perceive this great power of Christ resurrection , it by faith thou may certain believe nothing to be impossible with god."
A73502,50,1,11,IMAGE,4,"Only bringe thou fayth to Christes holy worde and sacrament , <NOTE> let thy repentauce shewe thy faith , let thy purpose of amendement and obedience of thy harte to gods lawe herafter , declare thy true beleue.","only bring thou faith to Christ holy word and sacrament , <NOTE> let thy repentance show thy faith , let thy purpose of amendment and obedience of thy heart to god law hereafter , declare thy true believe."
A73502,51,1,11,IMAGE,4,"Endeuoure thy selfe to saye wyth saynte Paule from henseforth : <NOTE> our conuersation is in heuen , fro whence we loke for a sauioure euen the Lorde Iesus Christ whych shall chauge our vyle bodyes that they may be fashioned lyke to hys glorious bodye , whyche he shal do by the same power , wherby he rose fro death and wherby he shal be able to subdue al thynges vnto hymselfe.","endeavour thy self to say with faint Paul from henceforth : <NOTE> our conversation be in heaven , fro whence we look for a saviour even the lord Jesus Christ which shall chauge our vile body that they may be fashion like to his glorious body , which he shall do by the same power , whereby he rise from death and whereby he shall be able to subdue all thing unto himself."
A73502,52,1,11,IMAGE,4,"Thus good christen people , forasmuche as ye haue herde these so great and excellent benefytes of Christes myghtye and glorious resurrection howe that he hath raunsomed synne , ouercome the deuyll , death , and hell , and hath victoriously obteyned the better hande of them all , to make vs fre and saufe from them : and knowynge , that we be by thys benefyte of hys resurrection rysen wyth hym by our fayth to lyfe euerlastynge , beynge in full suretie of oure hope , that we shall haue oure bodyes lykewyse reysed agayn from death , to haue them glorifyed in immortalitie and ioyned to hys gloryouse body , hauynge in the meane whyle hys holye spirite wythin our hartes as a seale and pledge of our euerlasting inheritaunce , by whose assistence we be replenyshed wyth all ryghteousnes : by whose power , we shall be able to subdue al our euel affections yt ryse againste the pleasure of God.","thus good christian people , forasmuch as you have herd these so great and excellent benefit of Christ mighty and glorious resurrection how that he have ransome sin , overcome the devil , death , and hell , and have victorious obtain the better hand of they all , to make we from and saufe from they : and know , that we be by this benefit of his resurrection rise with he by our faith to life everlasting , be in full surety of our hope , that we shall have our body likewise raise again from death , to have they glorify in immortality and join to his glorious body , have in the mean while his holy spirit within our heart as a seal and pledge of our everlasting inheritance , by who assistance we be replenish with all righteousness : by who power , we shall be able to subdue all our evil affection it rise against the pleasure of God."
A73502,53,1,11,IMAGE,4,"These thynges I saye well cosydered , let vs nowe in the reste of oure lyfe declare our fayth ye we haue to thys moost frutefull article , by conformyng vs therunto , in rysynge dayly from synne to ryghtousnes and holynes of lyfe.","Theise thing i say well cosydered , let we now in the rest of our life declare our faith you we have to this most fruitful article , by conform we thereunto , in rise daily from sin to righteousness and holiness of life."
A73502,54,1,11,IMAGE,4,"For what shall it auayle vs ( sayeth S. Peter ) to be escaped and delyuered from ye fylthynes of the worlde thorough the knolege of the Lorde & Sauiour Iesus Christe yf we be entangled agayne therwyth & be ouercome agayne , <NOTE> it had bene better ( sayeth he ) neuer to haue knowen the waye of ryghteousnes , than after it is knowen and receyued , to torne backewarde agayne from the holy comaundemente of God gyuen vnto vs. For so shall the prouerbe haue place in vs , wher it is sayd : <NOTE> dogge is retorned to hys vomyte agayn and the sowe that was washed , to her wallowynge in the myre agayne.","for what shall it avail we ( say S. Peter ) to be escape and deliver from you filthiness of the world through the knowledge of the lord and saviour Jesus Christe if we be entangle again therewith and be overcome again , <NOTE> it have be better ( say he ) never to have know the way of righteousness , than after it be know and receive , to turn backward again from the holy comaundemente of god give unto we for so shall the proverb have place in we , where it be say : <NOTE> dog be return to his vomit again and the sow that be wash , to she wallow in the mire again."
A73502,55,1,11,IMAGE,4,"What a shame were it for vs , beynge thus so clerely and frelye washed from oure synne , to retorne to the fylthynes therof agayne ?","what a shame be it for we , be thus so clear and free wash from our sin , to return to the filthiness thereof again ?"
A73502,56,1,11,IMAGE,4,"What a foly were it , thus endowed wyth ryghtousnes , to lose it agayne ?","what a folly be it , thus endow with righteousness , to lose it again ?"
A73502,57,1,11,IMAGE,4,"What madnes were it to lose the enherytaunce that we be nowe set in , for the vyle and transytory pleasure of synne ?","what madness be it to lose the inheritance that we be now set in , for the vile and transitory pleasure of sin ?"
