B00958,1520,15,72,IMAGE,60,"and as for the rule of scriptures, that is of the circumstauce of ye letter, and of other places of scripture, coferred wt the same, to gather therof yt very meaning of the thing, an example, whereof we haue.","and as for the Rule of Scriptures, that is of the circumstance of the Letter, and of other places of scripture, coferred with the same, to gather thereof that very meaning of the thing, an Exampl, whereof we have."
B00958,1521,15,72,IMAGE,60,<NOTE> Iohan. ii. and.xvi.,John ii. and xvi
B00958,1522,15,72,PAGE,60,"And here the vnlearned are to be taughte, that althoughe in the prophetes, and the histories of the olde testamente, tropes, and fygures are receyued, and allowed, forasmuche as by suche tropes, and fygures, the thing spoken, is more vehemently declared, and set forth, yet (as the excellent prelate, and notable great clerke, the Lorde byshop of winchester, nowe most worthy Lord chaunceler of England, in his learned booke of confutacio of heresies, against the sacrament of the aulter, doth prudetly aduertise vs,","And Here the unlearned Are to be taught, that although in the Prophets, and the histories of the old Testament, tropes, and figures Are received, and allowed, forasmuch as by such tropes, and figures, the thing spoken, is more vehemently declared, and Set forth, yet (as the excellent prelate, and notable great clerk, the Lord bishop of winchester, now most worthy Lord chancellor of England, in his learned book of confutacio of heresies, against the sacrament of the alter, does prudetly advertise us,"
B00958,1523,15,72,PAGE,60,"& clerly affyrme) in ye doctrine,","& clearly affirm) in the Doctrine,"
B00958,1524,15,72,PAGE,60,"& preceptes of the now militat churche, al thinges of our religion,","& Precepts of the now militat Church, all things of our Religion,"
B00958,1525,15,72,PAGE,60,"& faith, ought to be taken symply,","& faith, ought to be taken simply,"
B00958,1526,15,72,PAGE,60,"& plainely. And in very dede, yf in the sacramet of ye aulter were not ye true body of Christ, but a figure,","& plainly. And in very deed, if in the Sacrament of the alter were not you true body of christ, but a figure,"
B00958,1527,15,72,PAGE,60,"& a significatio onely of it, tha ye sacramets of ye new testamet shold haue nothing more, but rather lesse, the ye sacramets of ye olde testamet had, which is against ye catholyke doctrine of the churche,","& a significatio only of it, than you Sacraments of the new Testament should have nothing more, but rather less, the you Sacraments of the old Testament had, which is against you catholic Doctrine of the Church,"
B00958,1528,15,72,PAGE,60,& against al good reaso.,& against all good reason.
B00958,1529,15,72,PAGE,60,"An other obiection is this,","an other objection is this,"
B00958,1530,15,72,PAGE,60,"Christ at his laste supper, takynge the chalice, or cup into his handes, dyd after yt he had blessed it, saye."," christ At his laste supper, taking the chalice, or cup into his hands, did After that he had blessed it, say."
B00958,1531,15,72,PAGE,60,"<i> This cuppe is the newe testament, in my bloude. </i>","This cup is the new Testament, in my blood."
B00958,1532,15,72,PAGE,60,"And seyng these woordes must nedes, as they say be taken fyguratiuely, inasmuch as the very material cup it selfe, was neyther the newe testamente, ne yet the bloude of Christ, therefore lykewyse, these wordes also whych Christ, takig bread into his hades, blessig it, saying.","And sing these words must needs, as they say be taken fyguratiuely, inasmuch as the very material cup it self, was neither the new Testament, ne yet the blood of christ, Therefore likewise, these words also which christ, takig bred into his hades, blessig it, saying."
B00958,1533,15,72,PAGE,60,"<i> This is my body, </i> must nedes be take figuratiuely.","This is my body, must needs be take figuratively."
B00958,1534,15,72,PAGE,60,"For answer whereunto, we may say,","For answer whereunto, we may say,"
B00958,1535,15,72,PAGE,60,"<NOTE> as we did say before, to the same obiection, yt this argument is noughte,","as we did say before, to the same objection, that this argument is nought,"
B00958,1536,15,72,PAGE,60,"& very euyl framed, for thoughe we did admit a figure to be herein ye cuppe, yet it foloweth not therby, yt we must nedes take ye other speche, touchig ye body to be fyguratyue also, especially for yt in ye one speache, it is to wit, touchyng ye body, al the circustaces of the texte,","& very evil framed, for though we did admit a figure to be herein you cup, yet it Followeth not thereby, that we must needs take you other speech, touchig you body to be fyguratyue also, especially for that in you one speech, it is to wit, touching the body, all the circustaces of the text,"
B00958,1537,15,72,PAGE,60,"& course of scripture, doo enforce vs to take ye speache, properlye wherein ye other speache touchynge the cup, al the circumstances of the texte, and course of scripture dothe importe the contrary.","& course of scripture, do enforce us to take you speech, properly wherein the other speech touching the cup, all the Circumstances of the text, and course of scripture doth import the contrary."
B00958,1538,15,73,IMAGE,60,"An other obiection is, that Christe hathe but one true natural body:","an other objection is, that Christ hath but one true natural body:"
B00958,1539,15,73,IMAGE,60,"nowe (say they) one true natural body can not truely be but in one place, therefore say they, seynge Christes body, is truely in heauen, it can not be truely also in the sacrament of the aulter.","now (say they) one true natural body can not truly be but in one place, Therefore say they, sing Christ's body, is truly in heaven, it can not be truly also in the sacrament of the alter."
B00958,1541,15,73,IMAGE,61,"For aunswere <NOTE> whereunto maye be sayde, that in dede it is true, that Christe hathe but one true naturall bodye, and where they saye, that one true naturall body, can not be, but in one place, it is also true, after one,","For answer whereunto may be said, that in deed it is true, that Christ hath but one true natural body, and where they say, that one true natural body, can not be, but in one place, it is also true, After one,"
B00958,1542,15,73,IMAGE,61,"& the selfe same maner of beyng, but after dyuerse maners of beyng, one body, maye be sondry where, yea, and at one time to, it is to wyt, in heaue, in the visyble fourme, and maner of man, and in the sacrament of the aulter, vnder the forme, and maner of breade and wyne, and in eueryche of them, really, and truely to, in those respectes,","& the self same manner of being, but After diverse manners of being, one body, may be sundry where, yea, and At one time to, it is to wit, in heave, in the visible Form, and manner of man, and in the sacrament of the alter, under the Form, and manner of bread and wine, and in eueryche of them, really, and truly to, in those respects,"
B00958,1543,15,73,IMAGE,61,"God beynge therein the doer, who is omnipotent.","God being therein the doer, who is omnipotent."
B00958,1545,15,73,IMAGE,62,"There is also an other obiection, and that is this,","There is also an other objection, and that is this,"
B00958,1546,15,73,IMAGE,62,"God can make man, but man can not make God:","God can make man, but man can not make God:"
B00958,1547,15,73,IMAGE,62,"nowe saye they, yf the true body of Christe were, really, and in dede, in the sacrament of the aulter, than the priest which is a man, should therby make God, but ma can not make God, therefore in the sacramet of the aulter, ther is not the very true body of Christ.","now say they, if the true body of Christ were, really, and in deed, in the sacrament of the alter, than the priest which is a man, should thereby make God, but ma can not make God, Therefore in the Sacrament of the alter, there is not the very true body of christ."
B00958,1548,15,73,PAGE,62,"For aunswere <NOTE> whereunto, is to be saied, that this obiection procedeth of a greate ignoraunce, for he that maketh this obiectio, taketh that ye priest saying masse, and pronouncing the woordes of cosecracion, doeth make God, where in very dede, the priest goeth aboute no suche thynges, and yf he dyd, neyther he, ne yet god him selfe can make God, but the trueth is that the preist being the minister of God, and god beyng ther the worker with his worde, by the preist pronounced, there is caused the very body of Chryst to be ther present, wher it was not ther before,","For answer whereunto, is to be said, that this objection Proceedeth of a great ignorance, for he that makes this Objection, Takes that you priest saying mass, and pronouncing the words of cosecracion, doth make God, where in very deed, the priest Goes about no such things, and if he did, neither he, ne yet god him self can make God, but the truth is that the priest being the minister of God, and god being there the worker with his word, by the priest pronounced, there is caused the very body of Christ to be there present, where it was not there before,"
B00958,1549,15,73,PAGE,62,"& yet no new body ther made, but yt body ther preset which log ago was borne of the Vyrgyn Mary the, same (I say) in substaunce is there presente onelye, vnder the formes of breade, and wyne.","& yet no new body there made, but that body there preset which log ago was born of the Virgae Marry thee, same (I say) in substance is there present only, under the forms of bread, and wine."
B00958,1551,15,73,PAGE,63,"An other obiection <NOTE> there is, and that is thys S.","an other objection there is, and that is this S."
B00958,1552,15,73,PAGE,63,"Luke, in the.xvii. chapiter of the actes, doth testifye that S.","Lycia, in the xvii chapter of the acts, does testify that S."
B00958,1553,15,73,PAGE,63,"Paule, beyng at athens, and in mars strete, before the councell there, did saye, amongest other wordes, that God doth not dwell in temples made with handes, wherevpon the vnlearned, vnlernedly doth gather, that seyng the material temple is made with handes, and the sacrament of the aultar is in ye sayd materiall temple, it foloweth (say they) that the body and bloude of Chryst, can not be in it, because God doth not dwell in temples made with handes,","Paul, being At athens, and in mars street, before the council there, did say, amongst other words, that God does not dwell in Temples made with hands, whereupon the unlearned, unlearnedly does gather, that sing the material temple is made with hands, and the sacrament of the altar is in you said material temple, it Followeth (say they) that the body and blood of Christ, can not be in it, Because God does not dwell in Temples made with hands,"
B00958,1554,15,73,PAGE,63,"And this obiection hath bene soo muche liked, and commended amonges the proceding preachers abusing ye ignoraunt, yt they thought it ineuitable,","And this objection hath be so much liked, and commended among the proceeding Preachers abusing you ignorant, that they Thought it inevitable,"
B00958,1555,15,73,PAGE,63,"& therfore abusing the sayd people they caused it to be sette vp, and paynted for a gaye shew in the temples.","& Therefore abusing the said people they caused it to be Set up, and painted for a gay show in the Temples."
B00958,1557,15,73,PAGE,64,"For aunswere <NOTE> whervnto, this is to be tolde you, yt there is a great difference betwene beyng,","For answer whereunto, this is to be told you, that there is a great difference between being,"
B00958,1558,15,74,IMAGE,64,"& dwellyng in a place, for a greate manye of you, (I doubte not) haue bene both in the cheape syde, in Paules churche yarde, yea and Paules churche to, wher ye haue not, with moost due reuerence, vsed, and behaued your selues, and yet I am sure that ye dwell not there.","& Dwelling in a place, for a great many of you, (I doubt not) have be both in the cheap side, in Paul's Church yard, yea and Paul's Church to, where you have not, with most due Reverence, used, and behaved your selves, and yet I am sure that you dwell not there."
B00958,1559,15,74,IMAGE,64,"In dede, God is properlye sayde to dwell in heauen, because he there doth shew, and manifest his great glory, and in the hartes of iust, and good people, he is also sayde to dwell by grace, but as for other places, he is in them beyng, but not dwellyng.","In deed, God is properly said to dwell in heaven, Because he there does show, and manifest his great glory, and in the hearts of just, and good people, he is also said to dwell by grace, but as for other places, he is in them being, but not Dwelling."
B00958,1560,15,74,IMAGE,64,"And as concernyng the beyng of God in the sacrament of the aultare, forasmuch as there is the verye substaunce of chrystes natural, and true bodye, and bloude, taken of the Vyrgyn Mary, and that the diuinitie is, in vnitie of person, inseperably vnited, and ioyned to the sayd bodye and bloude, therefore we must say and beleue, that the godhed of Chryst is in the sacrament of the aultar, with his humanitie, in a very speciall sorte, and doth not thereby dwell in the sayde sacramente, and soo this obiection is not worth a good button, for all the bragges that hath bene made of it.","And as Concerning the being of God in the sacrament of the altar, forasmuch as there is the very substance of Christ's natural, and true body, and blood, taken of the Virgae Marry, and that the divinity is, in unity of person, inseparably united, and joined to the said body and blood, Therefore we must say and believe, that the godhead of Christ is in the sacrament of the altar, with his humanity, in a very special sort, and does not thereby dwell in the said sacrament, and so this objection is not worth a good button, for all the brags that hath be made of it."
B00958,1562,15,74,IMAGE,65,"Other fond, and folysh obiections, there are, which are not worthy to be answered vnto, and therefore are not nedefull to be touched, exhortyng you therfore in Chryst, fyrmely, and stedfastly, to beleue the doctrine of the catholyke churche herein, and so shal you auoyde daunger, please God, profit your selfe, and (lyuinge well) come at the last to ioy euerlastyng, which graunte vnto vs the father, the sonne, and the holy gost, to whom be honor and glory for euer AMEN.","Other found, and foolish objections, there Are, which Are not worthy to be answered unto, and Therefore Are not needful to be touched, exhorting you Therefore in Christ, firmly, and steadfastly, to believe the Doctrine of the catholic Church herein, and so shall you avoid danger, please God, profit your self, and (living well) come At the last to joy everlasting, which grant unto us the father, the son, and the holy ghost, to whom be honour and glory for ever AMEN."
B01041,1,0,1,IMAGE,1,"<i> Tunc abeuntes pharisei concilium inierunt, vt caperent Iesum in sermone. </i> Math. 22.","Tunc abeuntes Pharisees concilium inierunt, vt caperent Jesus in sermon. Math. 22."
B01041,3,0,1,IMAGE,2,"Then went the pharisees, and toke counsell, howe they myght take Iesus in his comunication.","Then went the Pharisees, and took counsel, how they might take jesus in his communication."
B01041,5,0,1,IMAGE,3,"T He naturall philosopher Plinius in the.x. boke of his naturall historye, describinge ye generation of the Viper, and the maner howe she bryngeth forthe hyr yongeons, sayth, that the male engendering putteth his heade in the females mouth:","THe THe natural philosopher Pliny in the x book of his natural history, describing the generation of the Viper, and the manner how she bringeth forth her yongeons, say, that the male engendering putteth his head in the females Mouth:"
B01041,6,0,1,IMAGE,3,whiche heade she for very pleasure bytyth of.,which head she for very pleasure bytyth of.
B01041,7,0,1,IMAGE,3,"And within.iii dayes after hauyng yongeons in hyr bely, maketh hast to bring the forth.","And within iii days After having yongeons in her belly, makes haste to bring the forth."
B01041,8,0,4,IMAGE,3,"But by reason of her slackenesse, they can not abyde within 1 page duplicate 1 page duplicate her, and gnawynge out hyr belly and sydes, violently breketh furth with slaughter of theyr mother.","But by reason of her slackness, they can not abide within 1 page duplicate 1 page duplicate her, and gnawing out her belly and sides, violently breaketh forth with slaughter of their mother."
B01041,10,0,4,IMAGE,4,<NOTE> What is this els (sayth saynt Augustyne) but the very pycture of an enuious person:,What is this Else (say saint Augustine) but the very pictured of an envious person:
B01041,11,0,4,IMAGE,4,ye trewe image of a malicious pharise.,you true image of a malicious Pharisee.
B01041,12,0,4,IMAGE,4,"The deuil putteth by suggestyon his head, the sede of malyce, rankor and enuye in to mans harte, and by and by such swetnes, such pleasure we coceyue of it, that we wyll not suffre hym to plucke out his head & venyme agayne, but gredely to our vtter destruction deuower it.","The Devil putteth by suggestion his head, the seed of malice, rancour and envy in to men heart, and by and by such sweetness, such pleasure we coceyue of it, that we will not suffer him to pluck out his head & venom again, but greedily to our utter destruction deuower it."
B01041,13,0,4,IMAGE,4,The viper hath yonge within.iii. dayes after hyr conceptio:,The viper hath young within iii days After her conceptio:
B01041,14,0,4,IMAGE,4,"and bycause she can bringe furth but one at a tyme together, they eate vp hyr belly,","and Because she can bring forth but one At a time together, they eat up her belly,"
B01041,15,0,4,IMAGE,4,& so she dyeth. The enuious person maketh more spede:,& so she Dies. The envious person makes more speed:
B01041,16,0,4,IMAGE,4,"he coceyueth no sooner, but incotinet he feleth such a gnawynge about his harte & sydys, that yf he kepe one hower or.ii. his venemous babe within him, he wyl braste belly, harte,","he coceyueth not sooner, but incotinet he feeleth such a gnawing about his heart & sydys, that if he keep one hour or ii his venomous babe within him, he will braste belly, heart,"
B01041,17,0,4,IMAGE,4,"& all together. The pharysees clokyd with hypocriticall holynes, wha they harde both olde & yong laudyng & praysyng Chryst with this melodious songe:","& all together. The Pharisees clokyd with hypocritical holiness, wha they harden both old & young lauding & praising Christ with this melodious song:"
B01041,18,0,4,IMAGE,4,<NOTE> <i> Osan na filio dauid: </i>,Osan na filio David:
B01041,19,0,4,IMAGE,4,"ingenderinge with the deuyll conceyued malyce, and brought furth indignatio, saieng:","ingenderinge with the Devil conceived malice, and brought forth indignatio, saying:"
B01041,20,0,4,IMAGE,4,<i> Audis quid isti dicut? </i>,Audis quid Isti dicut?
B01041,21,0,4,IMAGE,4,But here they were sone quayled by the testymony of ye lawe:,But Here they were soon quailed by the testimony of the law:
B01041,22,0,4,IMAGE,4,"Haue you not redde (sayth Christ) by the mouth of babes & suckelynges,","Have you not red (say christ) by the Mouth of babes & suckelynges,"
B01041,23,0,4,IMAGE,4,<NOTE> thou haste ordeyned thy prayse?,thou haste ordained thy praise?
B01041,24,0,4,IMAGE,4,"This, foyne could not kepe them backe, but at him they go agayn,","This, foin could not keep them back, but At him they go again,"
B01041,25,0,7,IMAGE,4,"& imperyously demaunde him, by what power or authorite he droue furth ye byers & sellers out of ye teple, why he dyd ouerthrow the tables of the mony 1 page duplicate 1 page duplicate exchaungers, and the seates of th^ doue sellers.","& imperyously demand him, by what power or Authority he drove forth the byers & sellers out of the Temple, why he did overthrow the tables of the money 1 page duplicate 1 page duplicate exchangers, and the seats of th^ dove sellers."
B01041,26,0,7,IMAGE,4,"And here to shew (a^ Salomon sayth) that there is n^ wysedome,","And Here to show (a Solomon say) that there is n^ Wisdom,"
B01041,27,0,7,IMAGE,4,"<NOTE> nor prudency, nor cou^sell able to preuayle agaynst god he asking them agayne the ques^^on of Ihons baptisme, when^ it was, ether fro heaue, or of men and they aunsweringe, they cold not tel, herde likewise of Christ * theyr confusion:","nor prudency, nor cou^sell able to prevail against god he asking them again the ques^^on of John's Baptism, when^ it was, either from heave, or of men and they answering, they could not tell, herd likewise of christ * their confusion:"
B01041,28,0,7,IMAGE,4,"Neyther I wy^ tell you, by what authorytie I d^ these thinges.","Neither I wy^ tell you, by what authorytie I d^ these things."
B01041,29,0,7,IMAGE,4,"Beside those quic^ aunswers, the parables folowin^ dyd byte them, and sore kyndl^ theyr anger, when he compary them to that sonne, which promysed his father to go into his vy^yarde, but went not:","Beside those quic^ answers, the parables folowin^ did bite them, and soar kyndl^ their anger, when he compary them to that son, which promised his father to go into his vy^yarde, but went not:"
B01041,30,0,7,IMAGE,4,"wherevppo^ he inferrethe, that the publycan and harlettes shall come into t^^ kyngedome of god, before the^ Agayne he proposyth the parab^ of the householder, which had left his seruauntes in his vyneyarde:","wherevppo^ he inferrethe, that the publycan and harlettes shall come into t^^ Kingdom of god, before The Again he proposyth the parab^ of the householder, which had left his Servants in his vineyard:"
B01041,31,0,7,IMAGE,4,"& whan he sent to haue the frutes of hit, they bette, stoned,","& when he sent to have the fruits of hit, they bet, stoned,"
B01041,32,0,7,IMAGE,4,"& kylled his messaungers. And at the last, put his owne sonne to deth.","& killed his messaungers. And At the last, put his own son to death."
B01041,33,0,7,IMAGE,4,What wyll the mayster of the household (sayth Christe) do to those murderers?,What will the master of the household (say Christ) do to those murderers?
B01041,34,0,7,IMAGE,4,Here they condene the selues when they geue this sentens:,Here they condene the selves when they give this sentens:
B01041,35,0,7,IMAGE,4,"He wyll cruelly destroy those persons & wyll let out his vyneyarde to other men, which shall delyuer him ye fruites at times couenient.","He will cruelly destroy those Persons & will let out his vineyard to other men, which shall deliver him you fruits At times convenient."
B01041,36,0,7,IMAGE,4,Vpo this answer christ cocludith.,Upon this answer Christ cocludith.
B01041,37,0,7,IMAGE,4,Therfore say I to you:,Therefore say I to you:
B01041,38,0,7,IMAGE,4,"the kingdome of god shalbe taken from you,","the Kingdom of god shall taken from you,"
B01041,39,0,7,IMAGE,4,"& shal be geuen to other, who shall bring forth ye fruytes of it.","& shall be given to other, who shall bring forth you fruits of it."
B01041,40,0,7,IMAGE,4,"Those, & such lyke thinges spoken in ye reproche of the chefe prestes and pharyseis sore greuyd them.","Those, & such like things spoken in you reproach of the chief Priests and Pharisees soar grieved them."
B01041,41,0,7,IMAGE,4,These styckes made a burnyng fyre in theyr hartes:,These sticks made a burning fire in their hearts:
B01041,42,0,8,IMAGE,4,"in so much yt they wolde hau^ set violently handes vpon Chris^ yf they had not feared the peopl^ Neuertheles, they cotinued fer^ in theyr pourpose.","in so much that they would hau^ Set violently hands upon Christ if they had not feared the People Nevertheless, they continued fer^ in their purpose."
B01041,43,0,8,IMAGE,4,"They lyke th^sty horse leches,","They like th^sty horse leches,"
B01041,44,0,8,IMAGE,4,"& insatiable blou^ suckers, wyl not leaue the skynn^ vntyl their bellies be ful of blou^ <i> Non missura cutem, </i>","& insatiable blou^ suckers, will not leave the skynn^ until their bellies be full of blou^ Non missura cutem,"
B01041,45,0,8,IMAGE,4,<NOTE> <i> nisi plena cruo^ hirudo. </i>,nisi plena cruo^ hirudo.
B01041,46,0,8,IMAGE,4,"Then after al those waye proued, and nothynge brought passe, they vseth circumuention and dissimulyng theyr malyce, v^der ye pretence of holynes & iustic^ dyd as ye gospel this day teache^ vs.","Then After all those Way proved, and nothing brought pass, they uses circumvention and dissimulyng their malice, v^der you pretence of holiness & Justice did as you gospel this day Teach us"
B01041,47,0,8,IMAGE,4,"<NOTE> Then went the pharisees, a^ toke counsell how they myght ta^gle Iesus in his communicatio^ And they sent to hym theyr disc^ples, with the Herodians, sayen^ Mayster we knowe that thou a trewe, and teacheste the waye god trewly:","Then went the Pharisees, a took counsel how they might ta^gle jesus in his communicatio^ And they sent to him their Disciples, with the Herodians, sayen^ Master we know that thou a true, and Teachest the Way god truly:"
B01041,48,0,8,IMAGE,4,Neyther carest th^ for any man:,Neither Carest th^ for any man:
B01041,49,0,8,IMAGE,4,for thou consyderest not mens estate.,for thou consyderest not men's estate.
B01041,50,0,8,IMAGE,4,Tell vs therfore: howe thynkest thou?,Tell us Therefore: how Thinkest thou?
B01041,51,0,8,IMAGE,4,Is it lawful to paye trybute to Caesar or no?,Is it lawful to pay tribute to Caesar or no?
B01041,52,0,8,IMAGE,4,"Iesus perceyuyng theyr wyckednesse, sayde:"," jesus perceiving their wickedness, said:"
B01041,53,0,8,IMAGE,4,Why tempte you me ye Hypocrites?,Why tempt you me the Hypocrites?
B01041,54,0,8,IMAGE,4,Let me se the trybute mony:,Let me see the tribute money:
B01041,55,0,8,IMAGE,4,And they toke hym a peny:,And they took him a penny:
B01041,56,0,8,IMAGE,4,and he sayd to them:,and he said to them:
B01041,57,0,8,IMAGE,4,"Whose image is this, and superscriptio?","Whose image is this, and superscriptio?"
B01041,58,0,8,IMAGE,4,They sayd to him: It is Caesars.,They said to him: It is Caesars.
