B00958,737,9,36,IMAGE,25,"and howe it may be knowen, yet I besech you most diligently, to note, and carye awaye one rule, which shall neuer deceaue you, but is a sure tryall of the catholyke churche, and the fayth thereof.","and how it may be known, yet I beseech you most diligently, to note, and carry away one Rule, which shall never deceive you, but is a sure trial of the catholic Church, and the faith thereof."
B00958,738,9,36,IMAGE,25,"This rule is not myne, but taken out of a learned, auncient, and ryghte godlye father in Christes Churche.","This Rule is not mine, but taken out of a learned, ancient, and right godly father in Christ's Church."
B00958,739,9,36,IMAGE,25,"He sayth <i> There are thre meanes to trye a churche, </i>","He say There Are Three means to try a Church,"
B00958,740,9,36,IMAGE,25,"<NOTE> <i> or doctryne, the fyrst is antiquitie, the second, is vniuersalitie, the thyrde, is vnitie. </i>","or Doctrine, the fyrst is antiquity, the second, is universality, the Third, is unity."
B00958,741,9,36,IMAGE,25,"By the fyrst, we are taught, that a true doctrine must be knowe, by that it is not lately spronge vp, or rysen, but commeth from Christ, and his apostles, and hath contynued styll in the churche.","By the fyrst, we Are taught, that a true Doctrine must be know, by that it is not lately sprung up, or risen, but comes from christ, and his Apostles, and hath continued still in the Church."
B00958,742,9,36,IMAGE,25,"By the seconde, we maye vnderstande, that a true fayth, or doctryne of the churche is that onelye, whiche vnyuersallye, in all countreys hath ben taught,","By the seconde, we may understand, that a true faith, or Doctrine of the Church is that only, which vnyuersallye, in all Countries' hath been taught,"
B00958,743,9,36,IMAGE,25,"& beleued. By the thirde we ought to learne, that a true doctryne, or fayth of the church, doth alwayes agre, and is alwayes one.","& believed. By the Third we ought to Learn, that a true Doctrine, or faith of the Church, does always agree, and is always one."
B00958,744,9,36,IMAGE,25,"Nowe those three thinges well noted, may instruct and teache any Christen man, to knowe the catholyke churche, whiche euer synce the Apostles tyme, and in all countreys, with one consent (in al thinges concernyng our fayth) hath shewed her self the worthy spouse of Chryst.","Now those three things well noted, may instruct and teach any christian man, to know the catholic Church, which ever since the Apostles time, and in all Countries', with one consent (in all things Concerning our faith) hath showed her self the worthy spouse of Christ"
B00958,745,9,36,IMAGE,25,"Contrary wyse, false doctryne, and heresye, euer hath doone, and shall doo to the worldes ende, <i> lately arise, & lurke in priuat corners, </i>","Contrary wise, false Doctrine, and heresy, ever hath done, and shall do to the world's end, lately arise, & lurk in private corners,"
B00958,746,9,36,IMAGE,25,<i> & neuer agre with itselfe. </i>,& never agree with itself.
B00958,747,9,36,IMAGE,25,"Which thyngs I myght easelye at large proue, and open to you, by playne and manifest demonstration.","Which things I might Easily At large prove, and open to you, by plain and manifest demonstration."
B00958,748,9,36,IMAGE,25,"But because in the nexte homelie,","But Because in the Next homely,"
B00958,749,9,36,PAGE,25,"I intende to speake of the aucthoritie of the churche, and also of the commoditie, and profite that we haue by the same, here I wyll make an ende,","I intend to speak of the Authority of the Church, and also of the commodity, and profit that we have by the same, Here I will make an end,"
B00958,750,9,36,PAGE,25,"<NOTE> besechyng all you (good and godly people) to geue your bodyes, and soules, an humble and holy sacryfyce to almyghtye God, prayinge euermore, that we may be altogether lyuelye membres, of oure sauyoure Iesus Chryst, and of his catholyke churche here vpon earth, and after this lyfe, partakers of the ioyfull kyngedome of heauen, through the same our Lorde Iesus Christ, to whom with the father, and the holy ghoste, be all honoure and glorye worlde without ende.","beseeching all you (good and godly people) to give your bodies, and Souls, an humble and holy sacrifice to almighty God, praying evermore, that we may be altogether lively members, of our Saviour jesus Christ, and of his catholic Church Here upon earth, and After this life, partakers of the joyful Kingdom of heaven, through the same our Lord jesus christ, to whom with the father, and the holy ghost, be all honour and glory world without end."
B00958,751,9,36,PAGE,25,Amen. H. Pendilton sacrae theologiae professoris.,Amen. H. Pendilton Sacrae Theologiae Professoris.
B00958,752,10,37,IMAGE,25,"An Homely, of the aucthoritie of the churche, declarynge what commoditie and profit we haue thereby.","an Homely, of the Authority of the Church, declaring what commodity and profit we have thereby."
B00958,754,10,37,IMAGE,26,"<i> L Ykewyse, as in </i> the laste homelye, it was declared to you (good chrysten people) what the churche is, and how it maye be knowen:","Likewise Likewise, as in the laste homely, it was declared to you (good christen people) what the Church is, and how it may be known:"
B00958,755,10,37,IMAGE,26,"soo nowe ye shall learne, the aucthoritie of the same catholyke church, and the commoditie, or profyt that ensueth to vs all, beynge members of the same churche.","so now you shall Learn, the Authority of the same catholic Church, and the commodity, or profit that ensueth to us all, being members of the same Church."
B00958,756,10,37,IMAGE,26,"Fyrste, whan oure sauioure Iesus Christ, dyd send forth the twelue apostles to preach, who were, and are, the cheife, and pryncipall pyllers of this catholyke churche, he dyd geue to them great power, and aucthoritie, as saynt Mathewe beareth wytnes,","First, when our Saviour jesus christ, did send forth the twelue Apostles to preach, who were, and Are, the chief, and principal pillars of this catholic Church, he did give to them great power, and Authority, as saint Matthew bears witness,"
B00958,757,10,37,IMAGE,26,"<NOTE> sayinge: <i> Iesus dyd call together the twelue disciples, and gaue to them power ouer vncleane spirites, that they shoulde cast them out, and shoulde heale all maner of diseases, and infirmities. </i>","saying: jesus did call together the twelue Disciples, and gave to them power over unclean spirits, that they should cast them out, and should heal all manner of diseases, and infirmities."
B00958,758,10,37,IMAGE,26,"And sondrye tymes we do rede in the holy Gospell, that our Sauiour Chryste doth speake to his Apostles, after this maner.","And sundry times we do rede in the holy Gospel, that our Saviour Christ does speak to his Apostles, After this manner."
B00958,759,10,37,IMAGE,26,"<i> Qui uos audit, me audit, </i>","Qui uos audit, me audit,"
B00958,760,10,37,IMAGE,26,"<i> & qui uos spernit, me spernit. </i>","& qui uos spernit, me spernit."
B00958,761,10,37,PAGE,26,"That is to saye: <i> He that heareth you, </i>","That is to say: He that hears you,"
B00958,762,10,37,PAGE,26,"<NOTE> <i> heareth me and he that dispiseth you, doth dispise me. </i>","hears me and he that despiseth you, does despise me."
B00958,763,10,37,PAGE,26,"Meanynge, <NOTE> and wyllynge thereby, that all the worlde shoulde know and confesse, the aucthoritie of the catholyke church, whiche Christ him selfe dyd buyld in, and vpon these hys holye Apostles.","Meaning, and willing thereby, that all the world should know and confess, the Authority of the catholic Church, which christ him self did build in, and upon these his holy Apostles."
B00958,764,10,37,PAGE,26,"And to the same purpose he sayd to them,","And to the same purpose he said to them,"
B00958,765,10,37,PAGE,26,"<i> Iam non dicam uos seruos, sed amicos &c </i> That is to say <i> Nowe I wyll no more call you seruauntes, </i>","Iam non dicam uos seruos, sed amicos etc. That is to say Now I will no more call you Servants,"
B00958,766,10,37,PAGE,26,<NOTE> <i> but frendes: </i>,but Friends:
B00958,767,10,37,PAGE,26,"for al thinges that I haue herde of my father,","for all things that I have herd of my father,"
B00958,768,10,37,PAGE,26,<i> I haue declared to you. </i>,I have declared to you.
B00958,769,10,37,PAGE,26,<NOTE> And agayne he sayth:,And again he say:
B00958,770,10,37,PAGE,26,"<i> As my father sente me, euen so I sende you. </i>","As my father sent me, even so I send you."
B00958,771,10,37,PAGE,26,"By these, and many such other places, we maye see, that our louynge sauiour, dyd giue greate aucthoritie to his Apostles.","By these, and many such other places, we may see, that our loving Saviour, did give great Authority to his Apostles."
B00958,772,10,37,PAGE,26,"But nowe it is expediente, and nedefull, to declare, in what specyall poyntes this aucthorytie doth consyste, and that the same aucthorytie was not onely geuen to the Apostles of Christe, but also to theyr successours, in the catholyke churche, euer to endure.","But now it is expedient, and needful, to declare, in what special points this aucthorytie does consyste, and that the same aucthorytie was not only given to the Apostles of Christ, but also to their Successors, in the catholic Church, ever to endure."
B00958,773,10,37,PAGE,26,"Whiche aucthoritie, thoughe it be greate, and manyfolde, yet these are the chefest partes thereof, that hereafter doo folowe.","Which Authority, though it be great, and manifold, yet these Are the chiefest parts thereof, that hereafter do follow."
B00958,774,10,37,PAGE,26,"Fyrste, almyghtye God, hath geuen power,","First, almighty God, hath given power,"
B00958,775,10,37,PAGE,26,"<NOTE> and aucthoritie, to the catholike churche, to haue the true sense, and vnderstandynge, of the holye Scripture, yea, and to approue also, or reproue al wryting, as Scripture, or no Scripture.","and Authority, to the catholic Church, to have the true sense, and understanding, of the holy Scripture, yea, and to approve also, or reprove all writing, as Scripture, or no Scripture."
B00958,776,10,37,PAGE,26,"Whiche thynge, good christen people, you may well vnderstande to be moost true, yf ye cal to remembraunce, who is the guyde, and gouernour of the churche, that is to wit, the holy Ghost:","Which thing, good christian people, you may well understand to be most true, if you call to remembrance, who is the guide, and governor of the Church, that is to wit, the holy Ghost:"
B00958,777,10,37,PAGE,26,"as Christe dyd promyse, sayinge.","as Christ did promise, saying."
B00958,778,10,38,IMAGE,26,"<i> Ego rogabo patrem et alium paracletum dabit vobis, vt maneat vobiscum ineternum, </i>","Ego rogabo patrem et Alium Paracletum Dabit vobis, vt Maneat vobiscum ineternum,"
B00958,779,10,38,IMAGE,26,"<NOTE> that is to saye,","that is to say,"
B00958,780,10,38,IMAGE,26,"<i> I wyll aske my father, and he wyll giue to you an other comforter, that he maye abyde wyth you for euer. </i>","I will ask my father, and he will give to you an other comforter, that he may abide with you for ever."
B00958,781,10,38,IMAGE,26,"And after that our Lord and sauiour had rysen fro death, he dyd breathe vpon hys Apostles, and sayde <i> Accipite spiritum sanctum Take you the holy ghost </i> and also,","And After that our Lord and Saviour had risen from death, he did breathe upon his Apostles, and said Accipite spiritum sanctum Take you the holy ghost and also,"
B00958,782,10,38,IMAGE,26,"<NOTE> after hys ascension into heauen, accordynge to his merciful promise, he did sende downe the holy Ghost vpon his Apostles,","After his Ascension into heaven, according to his merciful promise, he did send down the holy Ghost upon his Apostles,"
B00958,783,10,38,IMAGE,26,<NOTE> as saincte Luke writeth.,as saint Lycia Writeth.
B00958,784,10,38,IMAGE,26,"Nowe that the holy ghoste was not gyuen to the Apostles onely, but also to the catholyke churche, to the worldes ende, it is manyfest:","Now that the holy ghost was not given to the Apostles only, but also to the catholic Church, to the world's end, it is manifest:"
B00958,785,10,38,IMAGE,26,"forasmuche as Chryste dyd promyse the conforter, <i> vt maneat vobiscum inaeternum. </i>","forasmuch as Christ did promise the comforter, vt Maneat vobiscum inaeternum."
B00958,786,10,38,IMAGE,26,<i> That he should abyde </i> (sayeth he) <i> wyth you for euer. </i>,That he should abide (Saith he) with you for ever.
B00958,787,10,38,IMAGE,26,"Nowe we are mooste certayne,","Now we Are most certain,"
B00958,788,10,38,IMAGE,26,"<NOTE> that the Apostles of Christe dyd suffer deathe, for the faythe of Chryste, and that within fewe yeres, after they thus had receyued the holy ghoste.","that the Apostles of Christ did suffer death, for the faith of Christ, and that within few Years, After they thus had received the holy ghost."
B00958,789,10,38,IMAGE,26,"Neuertheles, Christ sending furthe hys Apostles to preache, and baptyze, sayd to the:","Nevertheless, christ sending forth his Apostles to preach, and baptyze, said to thee:"
B00958,790,10,38,IMAGE,26,<NOTE> <i> Ecce ego vobiscu sum omnibus diebus vsque ad consumation seculi. </i>,Ecce ego vobiscu sum omnibus diebus vsque ad consummation Seculi.
B00958,791,10,38,IMAGE,26,"That is, <i> Behold, </i>","That is, Behold,"
B00958,792,10,38,IMAGE,26,"<i> I am with you at al tymes, euen to the ende of the worlde. </i>","I am with you At all times, even to the end of the world."
B00958,793,10,38,IMAGE,26,"Wherefore we maye playnly see, that the holy ghoste beynge promised to the Apostles, to abyde for euer, and to the very ende of the world, was promised and giuen to them, and to their successours in ye churche, where he doth, and shall abide for euer.","Wherefore we may plainly see, that the holy ghost being promised to the Apostles, to abide for ever, and to the very end of the world, was promised and given to them, and to their Successors in you Church, where he does, and shall abide for ever."
B00958,794,10,38,PAGE,26,"Now forasmuche, as the holye ghoste is the gouernour and ruler of the catholyke churche, we ought there onely, and in no other corner, to serche the true vnderstandynge, and dyscernynge of the scryptures.","Now forasmuch, as the holy ghost is the governor and ruler of the catholic Church, we ought there only, and in no other corner, to search the true understanding, and dyscernynge of the Scriptures."
B00958,795,10,38,PAGE,26,"And for this cause, the aucient fathers (were they neuer so godly, and so wel learned) yet woulde they neuer presume vpon theyr owne iudgementes, but euer referred them selues, to the vnderstandyng, and interpretacion of the catholyke churche before them.","And for this cause, the ancient Father's (were they never so godly, and so well learned) yet would they never presume upon their own Judgments, but ever referred them selves, to the understanding, and Interpretation of the catholic Church before them."
B00958,796,10,38,PAGE,26,"Therfore the godly lerned, and ancient father <i> Ireneus, </i>","Therefore the godly learned, and ancient father Irenaeus,"
B00958,797,10,38,PAGE,26,"<NOTE> wryting agaynste schismaticall heresyes, sayeth thus.","writing against Schismatical heresies, Saith thus."
B00958,798,10,38,PAGE,26,"<i> Quid enim si qui de aliqua modica, questione disceptatio esset, nonne oporteret, in antiquissimas recurrere, </i>","Quid enim si qui de Any Modica, question Dispute esset, nonne oporteret, in antiquissimas recurrere,"
B00958,799,10,38,PAGE,26,"<i> Ecclesias. </i> &c. that is to saye,","Ecclesiastes. etc. that is to say,"
B00958,800,10,38,PAGE,26,"<i> but what and yf there were contencion concerning some smal question, were it not necessarye to returne to the mooste auncient churches, </i> and immediatly after, he sayeth:","but what and if there were contention Concerning Some small question, were it not necessary to return to the most ancient Churches, and immediately After, he Saith:"
B00958,801,10,38,PAGE,26,"<i> Quid autem si neque apostoli quidem scripturas reliquissent nobis, nonne oportebat ordinem sequi traditionis, quam tradiderunt hijs, quibus committebant Ecclesias? </i>","Quid autem si neque Apostles quidem scripturas reliquissent nobis, nonne Opportune ordinem sequi traditionis, quam tradiderunt hijs, quibus committebant Ecclesiastes?"
B00958,802,10,38,PAGE,26,"<i> What </i> (sayeth this holye father) <i> yf the Apostles had lefte to vs no scripture at all, had it not bene necessarye to folowe the order of that tradition, whyche they delyuered to those, to whome they dyd bequethe the churche? </i>","What (Saith this holy father) if the Apostles had left to us no scripture At all, had it not be necessary to follow the order of that tradition, which they Delivered to those, to whom they did bequeath the Church?"
B00958,803,10,38,PAGE,26,"Alas (good people) howe farre are manye in these dayes gone from this olde, and aunciet rule?","Alas (good people) how Far Are many in these days gone from this old, and aunciet Rule?"
B00958,804,10,38,PAGE,26,"this blessed martir, here exhorteth, or, rather commaundeth, that yf any small dyscorde, (thoughe it be in a matter of lytle importaunce) doo chaunce, that we woulde not, accordyng to our fantasy, iudge therein, but though we haue no scripture for the same, yet (sayeth he) we ought to folowe, kepe,","this blessed Martyr's, Here exhorteth, or, rather commandeth, that if any small discord, (though it be in a matter of little importance) do chance, that we would not, according to our fantasy, judge therein, but though we have no scripture for the same, yet (Saith he) we ought to follow, keep,"
B00958,805,10,39,IMAGE,26,and obserue the tradition of the aunciente churches.,and observe the tradition of the ancient Churches.
B00958,806,10,39,IMAGE,26,"Where as in these late dayes, the impudente procedars, haue taughte the zely people, that euery man shoulde, and may be a iudge of controuersyes, and that we oughte to obserue no tradition, nor ceremonye, other than we fynde in the holy scrypture.","Where as in these late days, the impudent procedars, have taught the zely people, that every man should, and may be a judge of controversies, and that we ought to observe no tradition, nor ceremony, other than we find in the holy scripture."
B00958,807,10,39,IMAGE,26,"Of suche, the same holy Ireneus dooeth speake thus, after many other notable lessons to the same purpose.","Of such, the same holy Irenaeus doth speak thus, After many other notable Lessons to the same purpose."
B00958,808,10,39,IMAGE,26,"<i> Omnes autem hij decidunt a veritate, </i> <NOTE> <i> et heritici quidem alienum ignem afferentes ad altare dei, id est, alienas doctrinas, a celesti igne conburentur. </i>","Omnes autem hij decidunt a veritate, et heritici quidem Alienum Ignem afferentes ad altar dei, id est, alienas doctrinas, a celesti Ignite conburentur."
B00958,809,10,39,IMAGE,26,&c. All these </i> (sayeth he) <i> doo fal from the trueth:,etc. All these (Saith he) do fall from the truth:
B00958,810,10,39,IMAGE,26,"<i> and the heretykes truely, bryngynge straunge fyre to the aulter of God, that is to saye, straunge doctrine, shalbe brent with the heuenly fyre. </i>","and the Heretics truly, bringing strange fire to the alter of God, that is to say, strange Doctrine, shall brent with the heavenly fire."
B00958,811,10,39,IMAGE,26,"With suche lyke threatnynges in the same place, to those that disobey the authoritie of the churche.","With such like threatnynges in the same place, to those that disobey the Authority of the Church."
B00958,812,10,39,IMAGE,26,"Lykewyse sainct Augustyne speakynge of the baptysme of chyldren, and howe that sacrament, can profyte them, seynge many die before they know the effecte of the same:","Likewise saint Augustine speaking of the Baptism of children, and how that sacrament, can profit them, sing many die before they know the Effect of the same:"
B00958,813,10,39,IMAGE,26,"affyrmeth, that the faythe of those that brynge the chylde to christenynge, shall profyte the childe that is broughte:","Affirmeth, that the faith of those that bring the child to christening, shall profit the child that is brought:"
B00958,814,10,39,IMAGE,26,"but for his probacion, <NOTE> he bryngeth thys.","but for his probation, he bringeth this."
B00958,815,10,39,IMAGE,26,<i> Hoc commendat ecclesie saluberrima authoritas. </i>,Hoc commendat Churches saluberrima Authoritas.
B00958,816,10,39,IMAGE,26,<i> This thynge the mooste holsome aucthoritye of the churche doethe commende. </i>,This thing the most wholesome Authority of the Church doth commend.
B00958,817,10,39,IMAGE,26,"And euen wyth lyke reuerence, the same saincte Augustyne, dooth many tymes submytte all hys iudgementes,","And even with like Reverence, the same saint Augustine, doth many times submit all his Judgments,"
B00958,818,10,39,IMAGE,26,<NOTE> and woorkes to the catholyke churche.,and works to the catholic Church.
B00958,819,10,39,IMAGE,26,"And fynally to declare hys iudgemente, concernynge the aucthoritye of the catholyke churche.","And finally to declare his judgement, Concerning the Authority of the catholic Church."
B00958,820,10,39,PAGE,26,"He saieth thus. <i> Ego vero Euagelio no crederem nisi me catholicae Ecclesiae commoueret authoritas, </i> yt is to say,","He Saith thus. Ego vero Evangel no crederem nisi me Catholic Ecclesiae commoueret Authoritas, that is to say,"
B00958,821,10,39,PAGE,26,"<i> Truely, </i> <NOTE> <i> I would not beleue the Gospell, onles that the aucthoritye of the catholyke churche dyd moue me thereto. </i>","Truly, I would not believe the Gospel, unless that the Authority of the catholic Church did move me thereto."
B00958,822,10,39,PAGE,26,"And we ought here to consyder, that after the ascension of our sauioure Christe, for the space of certayne yeares, there was no gospell at all wrytten:","And we ought Here to Consider, that After the Ascension of our Saviour Christ, for the Molle of certain Years, there was no gospel At all written:"
B00958,823,10,39,PAGE,26,"but all thynges, concernynge the faythfull christians, were ruled, and gouerned by the dyscyples of Christ, beyng than, the heades of the church.","but all things, Concerning the faithful Christians, were ruled, and governed by the Disciples of christ, being than, the Heads of the Church."
B00958,824,10,39,PAGE,26,"Afterwarde, we rede that dyuers of the dyscyples of Christe, dyd wryte Gospelles:","Afterward, we rede that Diverse of the Disciples of Christ, did write Gospels:"
B00958,825,10,39,PAGE,26,"as sainct Bartylmew, Nicodemus, and an other Gospel was called <i> Euangelium Nazareorum. </i>","as saint Bartholomew, Nicodemus, and an other Gospel was called Evangelium Nazareorum."
B00958,826,10,39,PAGE,26,"But the authorite of the churche, dyd onely admitte those fower euangelistes:","But the Authority of the Church, did only admit those fower Evangelists:"
B00958,827,10,39,PAGE,26,which nowe the whole churche dooth retayne.,which now the Whole Church doth retain.
B00958,828,10,39,PAGE,26,"Whyche thing might well seme maruelous, seynge that bothe saincte Bartylmew, and Nicodemus, were present, and dyd see the woorkes of Christ, and also dyd here hys doctryne, where as sainct Luke dyd learne hys gospell of saincte Paule, and other, and so lykewyse dyd S. marke but hereby it dooeth moost playnly appere, that the catholike churche onely, hathe this hye aucthorite, to dyscerne scriptures, and that scriptures allowed by the church shoulde not be refused of anye particulare persons.","Which thing might well seem marvelous, sing that both saint Bartholomew, and Nicodemus, were present, and did see the works of christ, and also did hear his Doctrine, where as saint Lycia did Learn his gospel of saint Paul, and other, and so likewise did S. mark but hereby it doth most plainly appear, that the catholic Church only, hath this high Authority, to discern Scriptures, and that Scriptures allowed by the Church should not be refused of any particular Persons."
B00958,829,10,39,PAGE,26,"Nowe therefore, seynge that the catholyke churche, bothe hathe delyuered, to vs the scripture, and in all ages and tymes, hath bene taken of all Godly lerned men, for the true iudge thereof.","Now Therefore, sing that the catholic Church, both hath Delivered, to us the scripture, and in all ages and times, hath be taken of all Godly learned men, for the true judge thereof."
B00958,830,10,40,IMAGE,26,"I exhort, and beseche all you (good christen people), that in all doutes, opinions, and controuersies, ye would resort to the holy churche, and there learne what the same catholyke church hath beleued, and taught, from time to time, concernynge doutes, or controuersies, and yf wyth lowly and meke hartes ye wyll so doo, surely the holy ghoste wyll instructe you, he wyll comforte you, and he wyl leade you, into al trueth.","I exhort, and beseech all you (good christian people), that in all doubts, opinions, and controversies, you would resort to the holy Church, and there Learn what the same catholic Church hath believed, and taught, from time to time, Concerning doubts, or controversies, and if with lowly and meek hearts you will so do, surely the holy ghost will instruct you, he will Comfort you, and he will lead you, into all truth."
B00958,831,10,40,IMAGE,26,"But yf in suche case, ye wil fly from the catholike church,","But if in such case, you will fly from the catholic Church,"
