B01041,1050,2,67,IMAGE,32,"& specially common offycers, which as it may be thought, be altogether vnlyke vnto Iohn for he (that he might more faithfully and truely execute his offyce, according to the wyl of his mayster) dyd forsake his parentes, wt their hole familie, yea & his patrimonie if that he sholde haue had any, as it is most like he sholde, he dyd also forsake and flye from idelnes, and the rest of the bodye, with delycate fare, and gorgious apparel he dyd take vpon him greate paynes, and labours, lyuynge hardly clothed in heare,","& specially Common Officers, which as it may be Thought, be altogether unlike unto John for he (that he might more faithfully and truly execute his office, according to the will of his master) did forsake his Parents, with their hold family, yea & his patrimony if that he should have had any, as it is most like he should, he did also forsake and fly from idleness, and the rest of the body, with delicate fare, and gorgeous apparel he did take upon him great pains, and labours, living hardly clothed in hear,"
B01041,1051,2,67,IMAGE,32,"<NOTE> he dyd lyberallye and boldlye reprehende offenders of all sortes, he hunted after the fauour of no manne, nor feared no mans threatnynges, but officers in these our dayes, be of a contrarye sorte, for they doo not regarde nor requyre an office, but for this ende, that they may promote and exalte their frendes, enlarge theyr patrimonie, lyue idely, fare dylycately, be appareled gorgiously,","he did liberally and boldly reprehend offenders of all sorts, he hunted After the favour of no man, nor feared no men threatnynges, but Officers in these our days, be of a contrary sort, for they do not regard nor require an office, but for this end, that they may promote and exalt their Friends, enlarge their patrimony, live idly, fare dylycately, be appareled gorgeously,"
B01041,1052,2,67,IMAGE,32,"& to bringe these thynges to pas, they flatter greate menne, the contempne, ye and polle poore men, if a ryche man of any parte do his dewtie, that he is commaunded to do, of his lorde, or kynge, by them he shalbe praysed, yea and well rewarded, but if the poore man do it with neuer so greate dylygence, there shall no worde be spoken of it:","& to bring these things to pass, they flatter great men, the contemn, you and Poll poor men, if a rich man of any part do his duty, that he is commanded to do, of his lord, or King, by them he shall praised, yea and well rewarded, but if the poor man do it with never so great diligence, there shall no word be spoken of it:"
B01041,1053,2,67,IMAGE,32,"agayne if the poore man therin offende, he shall be streyghtly punyshed, if the riche man omitte the hole, eyther the offycers mouthes shalbe stopped with a bribe, or els for feare of displeasure, they wyll let it slyp, so that in them it shall not be punysshed:","again if the poor man therein offend, he shall be streightly punished, if the rich man omit the hold, either the Officers mouths shall stopped with a bribe, or Else for Fear of displeasure, they will let it slip, so that in them it shall not be punished:"
B01041,1054,2,68,IMAGE,32,"these officers be be suche as Dauyd speakes on in his spalme, where he sayth,","these Officers be be such as David speaks on in his spalme, where he say,"
B01041,1055,2,68,IMAGE,32,"<i> Homo cum in honore esset, non intellexit coparatus est rumentis insipientibus: </i>","Homo cum in honore esset, non intellexit coparatus est rumentis insipientibus:"
B01041,1056,2,68,IMAGE,32,<i> & similis factus est illis. </i>,& Similis factus est illis.
B01041,1057,2,68,IMAGE,32,"Man when he was promoted vnto dignite or offyce dyd not considre him selfe, he is compared to folyshe brute beastes, and he is euen lyke vnto the in deade, for as the brute beaste doth neither remember thynges past, nor consyder thinges to come but gyue them selues altogether to these thinges that be presente, euen soo these officers do, for they neyther remembre wherof they be come, nor what they haue ben, nor yet what they may come to, if they abuse their office, and their mayster take dyspleasure with them, but loke what thinge doth playst them for the tyme, and that they enbrace:","Man when he was promoted unto dignity or office did not Consider him self, he is compared to foolish brutus beasts, and he is even like unto thee in dead, for as the brutus beast does neither Remember things past, nor Consider things to come but gyve them selves altogether to these things that be present, even so these Officers do, for they neither Remember whereof they be come, nor what they have been, nor yet what they may come to, if they abuse their office, and their master take displeasure with them, but look what thing does playst them for the time, and that they enbrace:"
B01041,1058,2,68,IMAGE,32,"And wel they may be likened vnto the noughtie seruaunt ye christ speaketh of which when his mayster had made ouerseer of his householde,","And well they may be likened unto the naughty servant you Christ speaks of which when his master had made overseer of his household,"
B01041,1059,2,68,IMAGE,32,"<NOTE> and was gon vnto a straunge contrye, sayd with hym self:","and was gone unto a strange country, said with him self:"
B01041,1060,2,68,IMAGE,32,"It wyl belong or my mayster come home agayne, and therefore he begonne to beate his fellow seruauntes, to eate and drincke with dronckerdes, euen so these offycers do thinke with them selues, that theyr actes can not come to ye eares of their lorde, or kynge, but let them take hede, for as it is a comon sayenge.","It will belong or my master come home again, and Therefore he begun to beat his fellow Servants, to eat and drink with dronckerdes, even so these Officers do think with them selves, that their acts can not come to you ears of their lord, or King, but let them take heed, for as it is a Common saying."
B01041,1061,2,68,IMAGE,32,"<i> Multae sunt Regum autes, et oculi. </i>","Multitude sunt Regum autes, et oculi."
B01041,1062,2,68,IMAGE,32,"Kynges haue manye eares, and eyes, and althoughe yt they can keape their factes close from the eares of a mortall kynge or lorde, yet they can not hyde the from him that is immortal:","Kings have many ears, and eyes, and although that they can keape their facts close from the ears of a Mortal King or lord, yet they can not hide thee from him that is immortal:"
B01041,1063,2,68,IMAGE,32,<NOTE> whose countenaunce is ouer all euell doers.,whose countenance is over all evil doers.
B01041,1064,2,69,IMAGE,32,"And he wyll come in that day that they leest weane, and that houre that they knowe not,","And he will come in that day that they least wean, and that hour that they know not,"
B01041,1065,2,69,IMAGE,32,"<NOTE> and wyll cut them into peces and gyue them theyr rewarde, wt ypocrites, where shalbe waylynge ang knasshynge of tethe learne therfore you offycers, of Iohn to forget those thinges that be behynde you, that is the world with the pompe therof, and set youre eyes onelye vppon those thinges that be before you, that is your dewtie, and that that doth pertayne to the faythfull performynge of your offices.","and will Cut them into Pieces and gyve them their reward, with Hypocrites, where shall wailing ang knasshynge of teeth Learn Therefore you Officers, of John to forget those things that be behind you, that is the world with the pomp thereof, and Set your eyes only upon those things that be before you, that is your duty, and that that does pertain to the faithful performing of your Offices."
B01041,1066,2,69,IMAGE,32,"And it shalbe sayd vnto euery one of you well thou faythfull and good seruant,","And it shall said unto every one of you well thou faithful and good servant,"
B01041,1067,2,69,IMAGE,32,"<NOTE> thou hast ben faythfull ouer a fewe thinges,","thou hast been faithful over a few things,"
B01041,1068,2,69,IMAGE,32,I shall constitute ye ouer many entre into the ioye of thy mayster for only that thynge dyd Iohn regarde:,I shall constitute you over many entre into the joy of thy master for only that thing did John regard:
B01041,1069,2,69,IMAGE,32,"wherefore ^e saith, that he is the voyce of a cryer in wyldernes.","Wherefore e Says, that he is the voice of a crier in Wilderness."
B01041,1070,2,69,IMAGE,32,"Christ in the gospell sayth vnto his Apostles, whe he sent them of preachynge, it shal not be you that shall speake, but the spyryte of my father shall speake in you, lykewise dauyd in his spalmes sayth."," christ in the gospel say unto his Apostles, when he sent them of preaching, it shall not be you that shall speak, but the Spirit of my father shall speak in you, likewise David in his spalmes say."
B01041,1071,2,69,IMAGE,32,"<NOTE> <i> Lingua mea calamus scribae, velociter scribentis. </i>","Lingua mea calamus Scribae, Velociter scribentis."
B01041,1073,2,69,IMAGE,33,"My tonge is the penne of a writer that writeth fast, signifyenge that his psalmes were not his, but they were the worke of the holy ghost:","My tongue is the pen of a writer that Writeth fast, signifyenge that his psalms were not his, but they were the work of the holy ghost:"
B01041,1074,2,69,IMAGE,33,"so Iohn here sayth he is the voyce of a cryer, as and if he sholde saye,","so John Here say he is the voice of a crier, as and if he should say,"
B01041,1075,2,69,IMAGE,33,"I speake nothynge of myne owne heade, but I speake those thinges that be commaunded me of my mayster to speake, lyberally vtterynge those thinges that my commission wylleth me to speake, and nothinge ther vnto addynge.","I speak nothing of mine own head, but I speak those things that be commanded me of my master to speak, liberally uttering those things that my commission willeth me to speak, and nothing there unto adding."
B01041,1077,2,70,IMAGE,34,"Wherfore if you reiecte my sayinge ye do not reiecte me, but rather hym that speaketh in me, for I am but a voyce whereby as by an instrument Christ doth declare vnto you his wyll.","Wherefore if you reject my saying you do not reject me, but rather him that speaks in me, for I am but a voice whereby as by an Instrument christ does declare unto you his will."
B01041,1078,2,70,IMAGE,34,"A voyce of * selfe is a sounde that goeth before the worde, so that if the worde do not folowe, the voyce is a vayne thinge, as it were brasse soundyng or a Cymball tincklynge.","A voice of * self is a sound that Goes before the word, so that if the word do not follow, the voice is a vain thing, as it were brass sounding or a Cymbal tincklynge."
B01041,1079,2,70,IMAGE,34,"And so was Iohn the voyce of Christ the euerlastynge worde of the father without whom Iohn sholde haue ben a vayne thinge, but now that the worde Christ dyd folowe the voyce is not vayne, but rather as Dauyd saith.","And so was John the voice of christ the everlasting word of the father without whom John should have been a vain thing, but now that the word christ did follow the voice is not vain, but rather as David Says."
B01041,1080,2,70,IMAGE,34,<i> Vox domini in virtute vox domini in magnificentia. </i>,Vox domini in virtute vox domini in Magnificence.
B01041,1081,2,70,IMAGE,34,"<NOTE> The voyce of our Lorde is in vertue ye voyce of our Lorde is in pythe,","The voice of our Lord is in virtue you voice of our Lord is in pythe,"
B01041,1082,2,70,IMAGE,34,"& in strength, the voyce of the lorde that pulleth downe the high trees of Libanus, whiche in dead Iohn dydde when he pulled downe the stoute hartes of the Iewes, so that by penaunce, they weare contente to be baptised of hym, yet it was not Iohn that dyd it, but it was he which stode the last great daye, of the feast and cryed sayenge,","& in strength, the voice of the lord that pulls down the high trees of Lebanon, which in dead John did when he pulled down the stout hearts of the Jews, so that by penance, they wear content to be baptised of him, yet it was not John that did it, but it was he which stood the last great day, of the feast and cried saying,"
B01041,1083,2,70,IMAGE,34,"<NOTE> yf any man be a thyrste let him come vnto me, and drincke:","if any man be a thirst let him come unto me, and drink:"
B01041,1084,2,70,IMAGE,34,"the Euangelyst saith that he cryed, whiche was bicause he wolde haue euery man to heare him, that euery man might be saued, <NOTE> & come to knoweledge of the truth, for it is not his wyl that any shold perysh.","the Evangelist Says that he cried, which was Because he would have every man to hear him, that every man might be saved, & come to knowledge of the truth, for it is not his will that any should perish."
B01041,1085,2,70,IMAGE,34,"Wherefore they erre whiche say, that of absolute necessite some must nedes be damned, for saynt Paule sayth.","Wherefore they err which say, that of absolute necessity Some must needs be damned, for saint Paul say."
B01041,1086,2,70,IMAGE,34,"<i> Periunt, pro eo quod dilectionem veritatis non receperunt, </i> <NOTE> <i> in hoc vt salui fierent. </i>","Periunt, Pro eo quod dilectionem veritatis non receperunt, in hoc vt salui fierent."
B01041,1087,2,71,IMAGE,34,"They do perishe, bicause they receiued not the loue of ye trueth, ye they myght haue bene saued, but peraduenture some wyll obiecte, and saye if he wolde haue euerye man saued then they shalbe saued for who can resiste his wyll:","They do perish, Because they received not the love of you truth, you they might have be saved, but Peradventure Some will Object, and say if he would have every man saved then they shall saved for who can resist his will:"
B01041,1088,2,71,IMAGE,34,"vnto this is to be aunswered that we must consydre two wylles to be in in god, a wyll that goeth before & an other that cometh after:","unto this is to be answered that we must Consider two wills to be in in god, a will that Goes before & an other that comes After:"
B01041,1089,2,71,IMAGE,34,by his fyrste wyll he wolde haue all men to walke in his commaundementes:,by his First will he would have all men to walk in his Commandments:
B01041,1090,2,71,IMAGE,34,"and so come to euerlastynge lyfe, but when he seeth the vntowardnes of those that wyll folow their owne lustes, and wyll not obey his commaundementes, then by his later wyl he wyl haue them punished accordinge to their desertes:","and so come to everlasting life, but when he sees the untowardness of those that will follow their own lusts, and will not obey his Commandments, then by his later will he will have them punished according to their deserts:"
B01041,1091,2,71,IMAGE,34,"as for an exemple. A man setteth a tree in his garden, wyllyng that it shall growe there manye yeares for to bringe forth fruyte, now within fewe yeares when he seeth that it wyll brynge forthe none, he commaundeth by and by contrary to his first wyll, to cutte it downe sayeng, where vnto doth it occupye the grounde in vayne.","as for an exemple. A man sets a tree in his garden, willing that it shall grow there many Years for to bring forth fruit, now within few Years when he sees that it will bring forth none, he commandeth by and by contrary to his First will, to Cut it down saying, where unto does it occupy the ground in vain."
B01041,1092,2,71,IMAGE,34,"It is not vnlike vnto this, that is writen in the psalme.","It is not unlike unto this, that is written in the psalm."
B01041,1093,2,71,IMAGE,34,<NOTE> <i> Vineam de Egipto transtulisti. </i>,Vineam de Egypt transtulisti.
B01041,1094,2,71,IMAGE,34,Thou haste brought out of Egypte a vine.,Thou haste brought out of Egypt a vine.
B01041,1095,2,71,IMAGE,34,"Thou haste caste out Gentyles,","Thou haste cast out Gentiles,"
B01041,1096,2,71,IMAGE,34,"& planted it, whiche vine (as the Psalmis sheweth to be breefe) for a tyme dyd greatly encrease and growe, so that the shadowe therof dyd couer the hylles, but after the hedge was pulled downe, and the wylde beastes did destroye it, and why,","& planted it, which vine (as the Psalms shows to be brief) for a time did greatly increase and grow, so that the shadow thereof did cover the hills, but After the hedge was pulled down, and the wild beasts did destroy it, and why,"
B01041,1097,2,71,IMAGE,34,"<NOTE> but bycause (as Esaie sayth) he loked yt it sholde haue brought grapes & it brought out thornes, so that the fault was in it, and not in him:","but Because (as Isaiah say) he looked that it should have brought grapes & it brought out thorns, so that the fault was in it, and not in him:"
B01041,1098,2,71,IMAGE,34,for god doth aske by Esaie and saythe:,for god does ask by Isaiah and say:
B01041,1099,2,71,IMAGE,34,"what sholde I haue done to my vineyard, that I haue not done:","what should I have done to my vineyard, that I have not done:"
B01041,1100,2,71,IMAGE,34,"truly nothynge. For as I haue sayde, he cryeth vnto vs,","truly nothing. For as I have said, he Cries unto us,"
B01041,1101,2,72,IMAGE,34,"wyllynge euery manne to amende his lyfe, and so to be saued.","willing every man to amend his life, and so to be saved."
B01041,1102,2,72,IMAGE,34,"Yea he hath cryed in olde tyme by his prophettes, after by hym selfe, his Apostels and disciples, and styll crieth vnto this daye, by his preachers, but we stoppe oure eares & wyll not heare, we be muche lyke vnto the people of London, which do heare after a sorte.","Yea he hath cried in old time by his Prophets, After by him self, his Apostles and Disciples, and still cries unto this day, by his Preachers, but we stop our ears & will not hear, we be much like unto the people of London, which do hear After a sort."
B01041,1103,2,72,IMAGE,34,"The belles of Paules, when they rynge to Matyns at mydnight, the belles do sounde in theyr eares, yet they wyll not ryse, but rather wyl tourne them on thother syde, and slepe agayne, for they thynke the daye is not as yet neare, euen soo do we heare the preachers of god, their voyce dothe sounde in oure eares, but we will not arise from our noughty lyfe:","The Bells of Paul's, when they ring to Matins At midnight, the Bells do sound in their ears, yet they will not rise, but rather will turn them on tother side, and sleep again, for they think the day is not as yet near, even so do we hear the Preachers of god, their voice doth sound in our ears, but we will not arise from our naughty life:"
B01041,1104,2,72,IMAGE,34,"but styll slepe in synne thinkynge that the daye doth not drawe neare, when as we shall make accompte of our actes, but let vs not deceyue our selues, for saynt Paule sayth, it is tyme for vs to ryse from slepe, the night is past and the day draweth neare Nowe if the day were neare in the tyme of saynt Paule, that is.xv. hundreth yeare a goo we maye well thinke that it is nowe verye neare, lette vs therfore open oure eares and heare him cryenge:","but still sleep in sin thinking that the day does not draw near, when as we shall make accompt of our acts, but let us not deceive our selves, for saint Paul say, it is time for us to rise from sleep, the night is past and the day draws near Now if the day were near in the time of saint Paul, that is xv Hundredth year a goo we may well think that it is now very near, let us Therefore open our ears and hear him crying:"
B01041,1105,2,73,IMAGE,34,"for yf we wyll not, we shall herafter crye, and he wyll not heare vs, but there shalbe other, that is to saye our noughty lyfe, and they vnto whom we haue done iniurye and wronge, accusynge vs, and they shalbe hearde. wherfore if we wyll stoppe the eares of god, that he shall not here oure accusars, we must here him when he cryeth, and also crye diligentely vnto hym by prayer, as Dauyd doth witnes of hym selfe that he dyd, sayenge.","for if we will not, we shall hereafter cry, and he will not hear us, but there shall other, that is to say our naughty life, and they unto whom we have done injury and wrong, accusing us, and they shall heard. Wherefore if we will stop the ears of god, that he shall not Here our accusars, we must hear him when he Cries, and also cry diligently unto him by prayer, as David does witness of him self that he did, saying."
B01041,1106,2,73,IMAGE,34,<i> De profundis clamaui ad te domine. </i>,De profundis clamaui ad te domine.
B01041,1107,2,73,IMAGE,34,"<NOTE> Lord I haue cryed vnto the from the bothome of my harte,","Lord I have cried unto thee from the bothome of my heart,"
B01041,1108,2,73,IMAGE,34,Lorde heare my voyce: and agayn.,Lord hear my voice: and again.
B01041,1109,2,73,IMAGE,34,"<i> Labo raui clamans, </i> <NOTE> I haue taken greate paynes in cryenge, so that I am horse while I trust in my lorde.","Labo raui Clamans, I have taken great pains in crying, so that I am horse while I trust in my lord."
B01041,1111,2,73,IMAGE,35,"But euen as we wyll not heare hym when he cryeth, so we be very neglygent in cryinge agayne to him.","But even as we will not hear him when he Cries, so we be very negligent in crying again to him."
B01041,1112,2,73,IMAGE,35,"For surely I do thinke that syns the begynnynge of Christes churche, there was neuer so lyttle prayer vsed among christen men, wherfore it may be well sayd vnto vs, that saynt Iames sayde vnto those that he wrote his epystle vnto, ye desyre and ye haue not, that ye desyre, ye enuye and ye haue indignation one towardes an other and ye can not obteigne, ye fyght, ye warre, and haue not, because ye aske it not, ye aske and receyue not bycause ye aske it amysse, that ye maye spende in your voluptuousnes.","For surely I do think that Sins the beginning of Christ's Church, there was never so little prayer used among christian men, Wherefore it may be well said unto us, that saint James said unto those that he wrote his epistle unto, you desire and you have not, that you desire, you envy and you have Indignation one towards an other and you can not obteigne, you fight, you war, and have not, Because you ask it not, you ask and receive not Because you ask it amiss, that you may spend in your voluptuousness."
B01041,1113,2,73,IMAGE,35,"To stande long in this thing, the tyme wyll not suffre me, but onlye this I wyll saye, that where as we stande, neade of many thynges all ready, we shall stande nede of moo:","To stand long in this thing, the time will not suffer me, but only this I will say, that where as we stand, neade of many things all ready, we shall stand need of moo:"
B01041,1114,2,73,IMAGE,35,if we wyll not heare hym crye and be dylygente in cryenge agayne to hym:,if we will not hear him cry and be dylygente in crying again to him:
B01041,1115,2,73,IMAGE,35,"and that not onelye in mouthe, but also in harte, yea and in lyfe:","and that not only in Mouth, but also in heart, yea and in life:"
B01041,1116,2,73,IMAGE,35,"For what shall it proffytte vs to call god oure father, yf we wyll not vse oure selues as louynge chyldren.","For what shall it proffytte us to call god our father, if we will not use our selves as loving children."
B01041,1117,2,73,IMAGE,35,"What shall it auayle vs, to desyre hym to delyuer vs from all euell, when as we oure selues wyllyngely, do fall hedlynges in to all wyckednesse.","What shall it avail us, to desire him to deliver us from all evil, when as we our selves willingly, do fallen hedlynges in to all wickedness."
B01041,1118,2,73,IMAGE,35,"But nowe lette vs heare what he cryeth by Iohn, he cryeth thus:","But now let us hear what he Cries by John, he Cries thus:"
B01041,1119,2,74,IMAGE,35,prepare and make readye the waye of oure Lorde.,prepare and make ready the Way of our Lord.
B01041,1120,2,74,IMAGE,35,"There be two wayes of our Lord, one is, whereby he commethe vnto vs, an other is whereby we goo vnto hym:","There be two ways of our Lord, one is, whereby he cometh unto us, an other is whereby we goo unto him:"
B01041,1121,2,74,IMAGE,35,"and bothe these muste be prepared of vs, after that we haue hard his voyce, as touchinge the fyrste, the condycyon and state of man is so myserable,","and both these must be prepared of us, After that we have heard his voice, as touching the First, the condition and state of man is so miserable,"
B01041,1122,2,74,IMAGE,35,"<NOTE> that he of hym selfe can not ones thyncke of the preparynge of this waye, nor of goynge vnto god.","that he of him self can not ones think of the preparing of this Way, nor of going unto god."
B01041,1123,2,74,IMAGE,35,"But the loue, mercy, and gentylnesse of god towarde man, is so great, that he wyllynglye of hym selfe dothe come vnto vs:","But the love, mercy, and gentleness of god toward man, is so great, that he willingly of him self doth come unto us:"
B01041,1124,2,74,IMAGE,35,"yea beynge his extreme enemyes, serchynge yf he can haue anye entraunce into our hertes, but yet althoughe that he commeth of his owne free wylle vnto vs withoute all oure desertes, we muste molyfye, yea and open our hartes, that he maye haue enteraunce, or elles he wyll departe agayne:","yea being his extreme enemies, searching if he can have any Entrance into our herts, but yet although that he comes of his own free will unto us without all our deserts, we must molyfye, yea and open our hearts, that he may have Entrance, or Else he will depart again:"
B01041,1125,2,74,IMAGE,35,"he saythe him selfe. <i> Ecce sto ad ostium, </i>","he say him self. Ecce Sto ad ostium,"
B01041,1126,2,74,IMAGE,35,"<i> & pulso. </i> <NOTE> Beholde I stande at the doore, and I knocke, and yf anye manne wyll heare my voyce, and open the doore I wyll come into hym, and I wyl suppe with him.","& pulso. Behold I stand At the door, and I knock, and if any man will hear my voice, and open the door I will come into him, and I will sup with him."
