B00958,0,3,3,IMAGE,0,"An Homely, of the creation and fall of man.","an Homely, of the creation and fallen of man."
B00958,2,3,3,IMAGE,1,"<i> T He Prophette, </i> Dauid in his forescore and ninteth psalme, exhortyng all people to synge prayse to almighti god, to serue hi in gladnes, and reioyse in his sight, alledgeth thys as a sufficient cause thereof.","THe THe Prophet, David in his forescore and ninteth psalm, exhorting all people to sing praise to almighty god, to serve him in gladness, and rejoice in his sighed, allegeth this as a sufficient cause thereof."
B00958,3,3,3,IMAGE,1,"<i> Scitote quoniam ipse est dominus, </i>","Scitote quoniam ipse est dominus,"
B00958,4,3,3,IMAGE,1,<NOTE> <i> ipse fecit nos et non ipsi nos. </i> which is to saye.,ipse fecit nos et non ipsi nos. which is to say.
B00958,5,3,3,IMAGE,1,"<i> Know you that he is our Lord it is he that made vs, and we made not our selfes. </i>","Know you that he is our Lord it is he that made us, and we made not our selves."
B00958,6,3,3,IMAGE,1,"And in dede, who yt diligently wayeth ye creatio of man, can not but therin most highly laude,","And in deed, who that diligently wayeth you Creation of man, can not but therein most highly laud,"
B00958,7,3,3,IMAGE,1,"& prayse almighty god, his creator.","& praise almighty god, his creator."
B00958,8,3,3,IMAGE,1,"For wher in the creation of al other visible thinges, he did but onely commaunde,","For where in the creation of all other visible things, he did but only command,"
B00958,9,3,3,IMAGE,1,"& will that they should be made, and incontinet they were made, in the creatyng of man, he vsed great solempnitie, and many notable circumstaunces.","& will that they should be made, and incontinet they were made, in the creating of man, he used great solemnity, and many notable Circumstances."
B00958,10,3,3,IMAGE,1,"Fyrst touchyng ma, <NOTE> he said, <i> let vs make ma, </i> which words be as it were the wordes of god the father, to God the sonne,","Fyrst touching ma, he said, let us make ma, which words be as it were the words of god the father, to God the son,"
B00958,11,3,3,IMAGE,1,"& to the holy ghost, spoken after the maner of men, when they go about some great matter, at what time they take good aduisement or they begyn, and doo ioyne with the best,","& to the holy ghost, spoken After the manner of men, when they go about Some great matter, At what time they take good advisement or they begin, and do join with the best,"
B00958,12,3,3,PAGE,1,"& wysest counsellours, that they can get.","& Wisest counsellors, that they can get."
B00958,13,3,3,PAGE,1,"Thys circumstaunce (not beyng necessary of goddes parte, as withoute the which he might haue created man) doth most manifestly declare the special fauour, of almyghty god towardes mankynde:","This circumstance (not being necessary of God's part, as without the which he might have created man) does most manifestly declare the special favour, of almighty god towards mankind:"
B00958,14,3,3,PAGE,1,"but that nexte circumstaunce, which doth immediatly folowe thys fyrst, is a more surer profe, and declaration of gods tender loue, towardes ma, whe he sayth.","but that Next circumstance, which does immediately follow this fyrst, is a more Surer proof, and declaration of God's tender love, towards ma, when he say."
B00958,15,3,3,PAGE,1,"<i> Let vs make man to our owne similitude & likenes, </i>","Let us make man to our own similitude & likeness,"
B00958,16,3,3,PAGE,1,"Now mark, good people, howe much god dyd for vs in our creation.","Now mark, good people, how much god did for us in our creation."
B00958,17,3,3,PAGE,1,"He made vs in very dede like vnto himselfe,","He made us in very deed like unto himself,"
B00958,18,3,3,PAGE,1,& in so doynge what could he haue done more for vs?,& in so doing what could he have done more for us?
B00958,19,3,3,PAGE,1,"A wonderfull excellet benefite & comfort is it vnto vs, to consyder that man was made like vnto god.","A wonderful excellet benefit & Comfort is it unto us, to Consider that man was made like unto god."
B00958,20,3,3,PAGE,1,"And to vnderstand this thyng the better, you shall know that the similitude, and likenes of man to god, was not in the body of man (for this you must moost certenly beleue, yt the godhed is a spirite,","And to understand this thing the better, you shall know that the similitude, and likeness of man to god, was not in the body of man (for this you must most Certainly believe, that the godhead is a Spirit,"
B00958,21,3,3,PAGE,1,"& not a bodely substaunce) but this similitude and likenes was in ye soule, which was endued, with most heuenly & godlike qualities, as vnderstandyng, memory, and wil, with sondry gyftes also of grace.","& not a bodily substance) but this similitude and likeness was in the soul, which was endued, with most heavenly & godlike qualities, as understanding, memory, and will, with sundry Gifts also of grace."
B00958,22,3,3,PAGE,1,"And here is to be noted by the way, that where almighty god sayeth,","And Here is to be noted by the Way, that where almighty god Saith,"
B00958,23,3,3,PAGE,1,"<i> Let vs make man to our owne similitude, </i>","Let us make man to our own similitude,"
B00958,24,3,3,PAGE,1,"<i> & lykenes, </i> he geueth vs to vnderstad, yt there be three parsons in trinitie,","& likeness, he Giveth us to Understand, that there be three parsons in trinity,"
B00958,25,3,3,PAGE,1,& yet but one god.,& yet but one god.
B00958,26,3,3,PAGE,1,"For in that he sayeth let vs make man, therein is signified, a pluralitie, or number of persones:","For in that he Saith let us make man, therein is signified, a plurality, or number of Persons:"
B00958,27,3,4,IMAGE,1,"agayne, in that he sayeth to our similitude and likenes, and not to oure similitudes and lykenesses, by thys is signyfyed the vnitie also of one nature and substaunce.","again, in that he Saith to our similitude and likeness, and not to our Similitudes and lykenesses, by this is signyfyed the unity also of one nature and substance."
B00958,28,3,4,IMAGE,1,"But to procede further concernyng the creation of man, ye shall vnderstand,","But to proceed further Concerning the creation of man, you shall understand,"
B00958,29,3,4,IMAGE,1,"<NOTE> that the second chapter of Moyses boke, called genesis, in speciall maner doth recorde the seuerall making, as well of the bodye of man, by it selfe, as also of the soule by it selfe.","that the second chapter of Moses book, called genesis, in special manner does record the several making, as well of the body of man, by it self, as also of the soul by it self."
B00958,30,3,4,IMAGE,1,"And as touching the body, scrypture doth there say, that.","And as touching the body, scripture does there say, that."
B00958,31,3,4,IMAGE,1,"<i> God fourmed, or shaped it, of ye earthe </i> Noting therby the excellecy of mans body, aboue the bodyes of other liuynge creatures.","God Form, or shaped it, of the earth Noting thereby the excellency of men body, above the bodies of other living creatures."
B00958,32,3,4,IMAGE,1,"For we rede not of anye other lyuyng creature, that god shaped, or fourmed, the body of it, but onely that he made it, and that at the comaundement of almighty god,","For we rede not of any other living creature, that god shaped, or Form, the body of it, but only that he made it, and that At the Commandment of almighty god,"
B00958,33,3,4,IMAGE,1,"<NOTE> <i> the earth brought fourth foure foted beastes, </i>","the earth brought fourth foure footed beasts,"
B00958,34,3,4,IMAGE,1,"& the water, in like maner, brought fourth fysshes,","& the water, in like manner, brought fourth fishes,"
B00958,35,3,4,IMAGE,1,<i> & foules. </i> Only of ye body of ma scripture witnesseth yt <i> God shaped it. </i>,& fowls. Only of you body of ma scripture Witnesseth that God shaped it.
B00958,36,3,4,IMAGE,1,"And as cocerning ye soule of ma, it is written of it, in the sayd second chapter of genesis,","And as Concerning the soul of ma, it is written of it, in the said second chapter of genesis,"
B00958,37,3,4,IMAGE,1,"<NOTE> howe yt god brethed it into the body, which.ii. circumstaunces, as they import a marueylous excellency of man, aboue other bodely creatures, so they most clerely declare thexcedyng great goodnes of God, towardes man.","how that god breathed it into the body, which ii Circumstances, as they import a marvelous excellency of man, above other bodily creatures, so they most clearly declare thexcedyng great Goodness of God, towards man."
B00958,38,3,4,IMAGE,1,"Now when god had, in such a singuler fashion, creted man, he gaue hym souereigntie ouer all the fysshes of the sea, ouer the foules of the ayer, and ouer the beastes of the lande, yea and made him a Kyng, and Emperour on the earth.","Now when god had, in such a singular fashion, Created man, he gave him sovereignty over all the fishes of the sea, over the fowls of the air, and over the beasts of the land, yea and made him a King, and Emperor on the earth."
B00958,39,3,4,PAGE,1,"And yet not satisfyed with al this, he placed man in Paradyse, that is in a most pleasaunt garden, where he had planted all kynd of frute, beautifull to beholde, and delicious to eate, for man to fede vpon, onely one kynde of fruyte he charged hym on payne of death, (and that not of the body alone, but of the soule also) vtterlye to refrayne from, which was the fruyte of the tree called in scrypture, the tre of knowledge of good, and euyl.","And yet not satisfied with all this, he placed man in Paradise, that is in a most pleasant garden, where he had planted all kind of fruit, beautiful to behold, and delicious to eat, for man to fede upon, only one kind of fruit he charged him on pain of death, (and that not of the body alone, but of the soul also) utterly to refrain from, which was the fruit of the tree called in scripture, the Tree of knowledge of good, and evil."
B00958,40,3,4,PAGE,1,"And lyke as in a most maruelous sorte he made Adam the fyrste man, so in as marueylous,","And like as in a most marvelous sort he made Adam the First man, so in as marvelous,"
B00958,41,3,4,PAGE,1,"& straunge a sort he made Eue the first woman, euen of a rybbe taken out of Adams lefte syde, and her he made parfytte, and furnyshed her with like gyftes as he had done Adame the first man:","& strange a sort he made Eue the First woman, even of a Rib taken out of Adams left side, and her he made parfytte, and furnished her with like Gifts as he had done Adam the First man:"
B00958,42,3,4,PAGE,1,"What canne we then thinke, or deuyse, that God might haue don more for vs in our creation, then herein he dyd:","What can we then think, or devise, that God might have dONE more for us in our creation, then herein he did:"
B00958,43,3,4,PAGE,1,"He made the soule immortall, that is such as shulde continue for euer without ende.","He made the soul immortal, that is such as should continue for ever without end."
B00958,44,3,4,PAGE,1,"He furnished it with moste singuler gyftes both of nature and of special grace also The body of man, in the estate of originall innocencie, had in it helth, strength, cumlines, and other like qualities, in the highest degre of perfection, it had in it selfe then, no fond lust, or concupiscens, no pronitie or inclination to euyl, no lothsumnes in doing good, no infirmitie or wekenesse, no lacke or want of any qualitie fyt and decent for it.","He furnished it with most singular Gifts both of nature and of special grace also The body of man, in the estate of original innocence, had in it health, strength, comeliness, and other like qualities, in the highest degree of perfection, it had in it self then, no found lust, or concupiscens, no pronity or inclination to evil, no lothsumnes in doing good, no infirmity or wekenesse, no lack or want of any quality fit and decent for it."
B00958,45,3,4,PAGE,1,"The body of man was then obediente to the soule, the soule altogether obedient to God.","The body of man was then obedient to the soul, the soul altogether obedient to God."
B00958,46,3,4,PAGE,1,"So that on Gods parte, oure maker and creator, there is nothyng towardes vs but all perfection, all great kyndnes, al fatherly loue,","So that on God's part, our maker and creator, there is nothing towards us but all perfection, all great kindness, all fatherly love,"
B00958,47,3,4,PAGE,1,"& fauour, Holy scrypture most euydently affyrmeth yt al creatures were made good in their creation, saying.","& favour, Holy scripture most evidently Affirmeth that all creatures were made good in their creation, saying."
B00958,48,3,4,PAGE,1,<i> Vidit deus omnia que fecerat et erant ualde bona. </i>,Vidit deus omnia que fecerat et Erant Valde Bona.
B00958,49,3,4,PAGE,1,"<i> Gene. i. </i> <NOTE> That is. <i> God sawe al things which he had made, and they were very good. </i>","Gene. i. That is. God saw all things which he had made, and they were very good."
B00958,50,3,5,IMAGE,1,"Which thyng as it is generally true in all creatures concerning their creation, so is it in a certen degre of excellencye to be verified in man touchyng the estate of his originall innocency.","Which thing as it is generally true in all creatures Concerning their creation, so is it in a certain degree of excellency to be verified in man touching the estate of his original innocency."
B00958,51,3,5,IMAGE,1,"Thus we may perceaue yt in the creation of man, al was excellent & parfytte, whiche oughte greatly to inflame vs the more to loue and serue almighty God our most louynge creator.","Thus we may perceive that in the creation of man, all was excellent & parfytte, which ought greatly to inflame us the more to love and serve almighty God our most loving creator."
B00958,52,3,5,IMAGE,1,"But for asmuche as that blessed estate is lost,","But for asmuch as that blessed estate is lost,"
B00958,53,3,5,IMAGE,1,"& mankynd by ye losse thereof, fell into extreme miserie and wretchednes, it is consequently to be well considered of our part, by what meanes man was brought from soo good and blessed a case, to so euyll and miserable an estate, whiche poynte well wayed, is a sufficiente grounde to cause vs on the other syde vtterly to detest & abhorre al synne.","& mankind by you loss thereof, fell into extreme misery and wretchedness, it is consequently to be well considered of our part, by what means man was brought from so good and blessed a case, to so evil and miserable an estate, which point well weighed, is a sufficient ground to cause us on the other side utterly to detest & abhor all sin."
B00958,54,3,5,IMAGE,1,For that greuous fal of man came of synne.,For that grievous fall of man Come of sin.
B00958,55,3,5,IMAGE,1,"Synne it was, for which God thrust man oute of paradyse, synne it was that caused the fleshe to striue agaynste the spirite, and the spirite, agaynst the fleshe, synne it was that broughte vnto mankynde necessitie of bodyly death, and all the infirmities and diseases, which man in thys transitory lyfe sustayneth, synne fynally it was, that caused all the posteritie of Adam and Eue to be borne in state of dampnation.","Sin it was, for which God thrust man out of paradise, sin it was that caused the Flesh to strive against the Spirit, and the Spirit, against the Flesh, sin it was that brought unto mankind necessity of bodily death, and all the infirmities and diseases, which man in this transitory life sustaineth, sin finally it was, that caused all the posterity of Adam and Eue to be born in state of damnation."
B00958,56,3,5,IMAGE,1,"But some perchaunce are desyrous fardar to knowe, by what meanes man was fyrst brought to commytte synne.","But Some perchance Are desirous fardar to know, by what means man was fyrst brought to commit sin."
B00958,57,3,5,IMAGE,1,"For the vnderstandyng whereof, <NOTE> lette vs haue recourse to the iii. chap. of Genesis, where it is wrytten:","For the understanding whereof, let us have recourse to the iii. chap. of Genesis, where it is written:"
B00958,58,3,5,PAGE,1,how that ye wyly serpent the deuyll came vnto Eue and sayde vnto her:,how that you wily serpent the Devil Come unto Eue and said unto her:
B00958,59,3,5,PAGE,1,<i> Why hath God gyuen you commaundement not to eate of euery tree in paradyse? </i>,Why hath God given you Commandment not to eat of every tree in paradise?
B00958,60,3,5,PAGE,1,where vnto the woman answered and sayde:,where unto the woman answered and said:
B00958,61,3,5,PAGE,1,"of the fruyte which is in paradise we eate, but of the frute of that tree yt groweth in the myddest of paradyse,","of the fruit which is in paradise we eat, but of the fruit of that tree that grows in the midst of paradise,"
B00958,62,3,5,PAGE,1,GOD hath charged vs not to eate or touche it?,GOD hath charged us not to eat or touch it?
B00958,63,3,5,PAGE,1,"leste, perchaunce we dye.","lest, perchance we die."
B00958,64,3,5,PAGE,1,Then sayde the serpente to the woman:,Then said the serpent to the woman:
B00958,65,3,5,PAGE,1,"Naye, you shall not dye.","Nay, you shall not die."
B00958,66,3,5,PAGE,1,"For God knoweth that whatsoeuer daye you shall eate thereof, youre eyes shalbe opened, and you shalbe like Gods, knowynge good and euyll.","For God Knoweth that whatsoever day you shall eat thereof, your eyes shall opened, and you shall like God's, knowing good and evil."
B00958,67,3,5,PAGE,1,"<i> The woman therefore saw that the tree was good to eate of, and beautifull to the eye, and pleasaunte to beholde, and she tooke of the fruyte thereof and dyd eate, and gaue part to her husbad, who also dyd eate. </i>","The woman Therefore saw that the tree was good to eat of, and beautiful to the eye, and pleasant to behold, and she took of the fruit thereof and did eat, and gave part to her Husband, who also did eat."
B00958,69,3,5,PAGE,2,"Thus through the prouocation of the deuyll, man first fell into synne.","Thus through the provocation of the Devil, man First fell into sin."
B00958,70,3,5,PAGE,2,"Wherefore as we must alwayes abhorre synne and forbeare it, bycause of the greate misery it brought vs vnto, so should we no les hate, and to the vttermost of our power, fly the deuyl and all his suggestions, knowing that thereby we were fyrst induced to commytte synne.","Wherefore as we must always abhor sin and forbear it, Because of the great misery it brought us unto, so should we not les hate, and to the uttermost of our power, fly the Devil and all his suggestions, knowing that thereby we were fyrst induced to commit sin."
B00958,71,3,5,PAGE,2,"For as thys oure aduersary was busye at the begynnynge with oure fyrst parentes, so is he no les,","For as this our adversary was busy At the beginning with our fyrst Parents, so is he no less,"
B00958,72,3,5,PAGE,2,"<NOTE> but rather more busye with vs at thys present, as wytnesseth Saynt Peter in the.v. chapiter of his first epystle, saying.","but rather more busy with us At this present, as Witnesseth Saint Peter in the v chapter of his First epistle, saying."
B00958,73,3,6,IMAGE,2,"<i> Youre aduersary the deuyl, as a roryng lion goeth about, seking whom he may deuour. </i>","Your adversary the Devil, as a roaring Lion Goes about, seeking whom he may devour."
B00958,74,3,6,IMAGE,2,"Thys aduersary of mankynde, disdaynynge at the greate felycytye that Adam and Eue were in, neuer ceasyd questionynge, and craftyng with the woman, being the weker and trayler vessell, vntyll he had made them disobey gods commaundement:","This adversary of mankind, disdaining At the great felycytye that Adam and Eue were in, never ceased questioning, and craftyng with the woman, being the weker and trailer vessel, until he had made them disobey God's Commandment:"
B00958,75,3,6,IMAGE,2,"by which their doyng, they lost the orygynall great innocency which they had at there creation, which being lost, nether the body woulde be obedient to ye soule, nor the soule to god, but al was in man turned vpsidoune:","by which their doing, they lost the original great innocency which they had At there creation, which being lost, neither the body would be obedient to you soul, nor the soul to god, but all was in man turned vpsidoune:"
B00958,76,3,6,IMAGE,2,"yea therby they fel also into necessitie of temporall death of body, and (which is worst of all) into the estate of eternall damnation, and euerlasting death, both of body and soule.","yea thereby they fell also into necessity of temporal death of body, and (which is worst of all) into the estate of Eternal damnation, and everlasting death, both of body and soul."
B00958,77,3,6,IMAGE,2,"But now, because it maye paraduenture seme in some mans iudgement, that seyng the thing that Adam and Eue did;","But now, Because it may Peradventure seem in Some men judgement, that sing the thing that Adam and Eue did;"
B00958,78,3,6,IMAGE,2,"was but the eatynge of an appell, therefore their faut was not great, nor deserued so greuous punishment, let vs consider the circumstaunces, and we shall sone perceyue the offence not lyght, but verye sore and heynous.","was but the eating of an Appeal, Therefore their fault was not great, nor deserved so grievous punishment, let us Consider the Circumstances, and we shall soon perceive the offence not Light, but very soar and heinous."
B00958,79,3,6,IMAGE,2,"Fyrst the thyng which god commaunded man to forbeare, was a thyng most easye for hym to forbeare, and so much was his faute the greater.","Fyrst the thing which god commanded man to forbear, was a thing most easy for him to forbear, and so much was his fault the greater."
B00958,80,3,6,IMAGE,2,"Besides this, whan a man is tolde before of great peryll and daunger that shall lyght vpon him if he doo this or that, in case after such warnyng he offende therein, his fault is thereby made the greuouser.","Beside this, when a man is told before of great peril and danger that shall Light upon him if he do this or that, in case After such warning he offend therein, his fault is thereby made the greuouser."
B00958,81,3,6,IMAGE,2,"Thyrdly, the lesse inclination a man hath to any synne, the more he synneth yf he doo the same.","Thirdly, the less inclination a man hath to any sin, the more he Sinneth if he do the same."
B00958,82,3,6,PAGE,2,"Nowe Adam and Eue, had in them no inclination at al, nother to one vice nor to other.","Now Adam and Eue, had in them no inclination At all, neither to one vice nor to other."
B00958,83,3,6,PAGE,2,"Fourthly, when a man hath late receyued great benefites at hys soueraygns handes, if he incontinently breake his expresse wyll, the contempt and disobedience is made therby the greater.","Fourthly, when a man hath late received great benefits At his sovereigns hands, if he incontinently break his express will, the contempt and disobedience is made thereby the greater."
B00958,84,3,6,PAGE,2,"The thyng that Adam and Eue dyd eate, was in dede but an appell, yet the eatyng thereof in that case, was an high disobediece against god, and the corrupting of all mankynd, for as much as they two were the very route, whereof all men must ryse, and the route being once naughte, howe can the tree or braunches, cummynge of that route, be good?","The thing that Adam and Eue did eat, was in deed but an Appeal, yet the eating thereof in that case, was an high disobedience against god, and the corrupting of all mankind, for as much as they two were the very rout, whereof all men must rise, and the rout being once naught, how can the tree or branches, coming of that rout, be good?"
B00958,85,3,6,PAGE,2,Therfore S. Paule in his Epistle to ye Romaines in the.v. chapiter thereof saieth.,Therefore S. Paul in his Epistle to the Romans in the v chapter thereof Saith.
B00958,86,3,6,PAGE,2,"<NOTE> <i> By the offence of one man, synne came vpon all men, to condempnacion, </i> and in the same chapiter immediatly after, he sayeth to lyke purpose, <i> throughe the disobedience of one man, manye became synners. </i>","By the offence of one man, sin Come upon all men, to condemnation, and in the same chapter immediately After, he Saith to like purpose, through the disobedience of one man, many became Sinners."
B00958,87,3,6,PAGE,2,And within a lytle after he saieth.,And within a little After he Saith.
B00958,88,3,6,PAGE,2,"<i> Sinne came into this world by one man, </i>","Sin Come into this world by one man,"
B00958,89,3,6,PAGE,2,"& through synne came death,","& through sin Come death,"
B00958,90,3,6,PAGE,2,<i> & so death passed to al me. </i>,& so death passed to all me.
B00958,91,3,6,PAGE,2,"Thus haue you hard fyrste the louynge kyndnes of God to man, in that he created hym in so worthye a maner, nexte ye haue harde the myschyfe that commeth to mankynd by synne, and thirdly what an extreme enemy also the deuyll is vnto vs.","Thus have you heard First the loving kindness of God to man, in that he created him in so worthy a manner, Next you have harden the myschyfe that comes to mankind by sin, and Thirdly what an extreme enemy also the Devil is unto us"
B00958,92,3,6,PAGE,2,"In an other homily hereafter, ye shal heare of the exceding great mercy of god, in deliuering makind by a meruelous maner, out of the estate of this dampnatio.","In an other homily hereafter, you shall hear of the exceeding great mercy of god, in delivering makind by a marvelous manner, out of the estate of this dampnatio."
B00958,93,3,7,IMAGE,2,"Wherfore to conclude for thys presente tyme, this shalbe to exhort you, that you fayle not daylye and howrelye to geue most harty thankes to almyghty God, for that he of his mere goodnes created you,","Wherefore to conclude for this present time, this shall to exhort you, that you fail not daily and howrelye to give most hearty thanks to almighty God, for that he of his mere Goodness created you,"
